FID,Site_ID,Ident,Ident_Len,Juction_Desc,OBU_Displa,Char_Count,Is_PC,Traffic_Light.Junction_X,Traffic_Light.Junction_Y
391,1345,2185 YISHUN CTRL SVC RD PC NR NTH PT EXT.,41,,YISHUN CTRL SVC RD PC NR NTH PT EXT.,36,TRUE,28325,45712
393,1347,2245 YISHUN CTRL 1 PC NR BLK 932,32,,YISHUN CTRL 1 PC NR BLK 932,27,TRUE,28477,45321
397,1353,0329 YISHUN AVE 6 PC NR CHONGFU PRI SCH,39,,YISHUN AVE 6 PC NR CHONGFU PRI SCH,34,TRUE,28738,46783
400,1356,2289 YISHUN AVE 6 PC NR 335A,28,,YISHUN AVE 6 PC NR 335A,23,TRUE,29302,46104
402,1360,2835 YISHUN AVE 6 PC NR BLK 384,31,,YISHUN AVE 6 PC NR BLK 384,26,TRUE,29678,45891
403,1361,0913 YISHUN RG RD PC NR 259,27,,YISHUN RG RD PC NR 259,22,TRUE,28628,46259
405,1363,1032 YISHUN RG RD PC NR 314,27,,YISHUN RG RD PC NR 314,22,TRUE,28998,45933
406,1364,1033 YISHUN RG RD PC NR 359,27,,YISHUN RG RD PC NR 359,22,TRUE,29439,45472
407,1365,1320 YISHUN RG RD PC NR 413,27,,YISHUN RG RD PC NR 413,22,TRUE,29381,45208
408,1366,"1814 YISHUN RING RD PC KHATIB BONGSU PK, BLK 331",48,,"YISHUN RING RD PC KHATIB BONGSU PK, BLK 331",43,TRUE,29337,45777
411,1372,1090 YISHUN RG RD PC NR Yishun Pri Sch,38,,YISHUN RG RD PC NR Yishun Pri Sch,33,TRUE,28036,46234
412,1373,0741 YISHUN RG RD PC NR BLK 122,31,,YISHUN RG RD PC NR BLK 122,26,TRUE,27695,46301
413,1374,0740 YISHUN RG RD PC NR 103,27,,YISHUN RG RD PC NR 103,22,TRUE,27589,45929
414,1375,1904 YISHUN ST 11 PC AHMAD IBRAHIM PRI SCH,42,,YISHUN ST 11 PC AHMAD IBRAHIM PRI SCH,37,TRUE,27862,46089
415,1376,2837 YISHUN ST 21 PC NR  BLK 219,32,,YISHUN ST 21 PC NR  BLK 219,27,TRUE,28364,46179
418,1383,0914 YISHUN AVE 5 PC NR 101 and 701,35,,YISHUN AVE 5 PC NR 101 and 701,30,TRUE,27442,45777
419,1391,0782 YISHUN RG RD PC NR JIEMIN PRI SCH,38,,YISHUN RG RD PC NR JIEMIN PRI SCH,33,TRUE,27661,45602
421,1393,0911 YISHUN RG RD PC NR YISHUN JC,33,,YISHUN RG RD PC NR YISHUN JC,28,TRUE,27865,45256
423,1395,0951 YISHUN RG RD PC NR 795,27,,YISHUN RG RD PC NR 795,22,TRUE,27848,44588
424,1396,1919 YISHUN ST 71 PC NR JIEMIN PRI SCH,38,,YISHUN ST 71 PC NR JIEMIN PRI SCH,33,TRUE,27598,45434
432,1409,2953 YISHUN AVE 1 PC NR BLK 430B,32,,YISHUN AVE 1 PC NR BLK 430B,27,TRUE,0,0
442,1504,1515 SEMBAWANG CRES PC,22,,SEMBAWANG CRES PC,17,TRUE,26135,47385
445,1507,1689 ADMIRALTY DR PC NR BLK 359,31,,ADMIRALTY DR PC NR BLK 359,26,TRUE,26058,47981
447,1509,2066 SEMBAWANG WAY PC NR BLK 358A,33,,SEMBAWANG WAY PC NR BLK 358A,28,TRUE,26154,47808
449,1511,1735 SEMBAWANG DR PC NR BLK 481,31,,SEMBAWANG DR PC NR BLK 481,26,TRUE,26082,48292
450,1512,1736 ADMIRALTY LINK PC,22,,ADMIRALTY LINK PC,17,TRUE,26163,48479
452,1514,1838 SEMBAWANG DR PC SUN PLAZA,30,,SEMBAWANG DR PC SUN PLAZA,25,TRUE,26375,47783
454,1516,1860 SEMBAWANG DR PC NR BLK 484,31,,SEMBAWANG DR PC NR BLK 484,26,TRUE,25909,48786
457,1519,2282 SEMBAWANG DR PC NR ADMIRALTY LANE,38,,SEMBAWANG DR PC NR ADMIRALTY LANE,33,TRUE,25993,49069
459,1522,2180 SEMBAWANG ALLEY PC NR MRT STN,34,,SEMBAWANG ALLEY PC NR MRT STN,29,TRUE,26497,47811
460,1531,2022 SEMBAWANG CRESCENT PC NR BLK 326,37,,SEMBAWANG CRESCENT PC NR BLK 326,32,TRUE,26361,47317
462,1602,2805 GAMBAS AVE PC NR NORDCOM 1,31,,GAMBAS AVE PC NR NORDCOM 1,26,TRUE,25765,47258
463,1603,3058 GAMBAS WAY PC NR ASCENT GAMBAS,35,,GAMBAS WAY PC NR ASCENT GAMBAS,30,TRUE,0,0
467,1704,2277 WEST CAMP RD PC NR SYFC,28,,WEST CAMP RD PC NR SYFC,23,TRUE,31176,44125
481,3111,0805 AYE SLIP RD/KEPPEL RD PC,29,,AYE SLIP RD/KEPPEL RD PC,24,TRUE,27815,28401
487,3120,0870 BT PURMEI AVE PC NR 109,28,,BT PURMEI AVE PC NR 109,23,TRUE,27027,28530
490,3124,0561 TELOK BLANGAH CRESCENT PC NR BLK12,39,,TELOK BLANGAH CRESCENT PC NR BLK12,34,TRUE,26533,28864
491,3125,1210 TELOK BLANGAH CRES PC NR 6,31,,TELOK BLANGAH CRES PC NR 6,26,TRUE,26392,28937
492,3131,0469 TELOK BLANGAH RD PC NR BT CHERMIN,38,,TELOK BLANGAH RD PC NR BT CHERMIN,33,TRUE,25830,27991
495,3134,1891 HARBOURFRONT PLACE PC,26,,HARBOURFRONT PLACE PC,21,TRUE,26449,27534
503,3146,0225 DEPOT RD PC NR 112,23,,DEPOT RD PC NR 112,18,TRUE,25369,29346
508,3151,*#0792 ALEXANDRA RD PC NR PSA BLDG,34,,ALEXANDRA RD PC NR PSA BLDG,27,TRUE,24522,28502
511,3154,0863 PASIR PANJANG RD PC NR ALEXANDRA LANE,42,,PASIR PANJANG RD PC NR ALEXANDRA LANE,37,TRUE,24006,28550
516,3160,2441 HARBOUR DR PC NR PASIR PANJANG NPP,39,,HARBOUR DR PC NR PASIR PANJANG NPP,34,TRUE,0,0
517,3161,2479 TELOK BLANGAH HEIGHTS PC NR BLANGAH RISE PRI,49,,TELOK BLANGAH HEIGHTS PC NR BLANGAH RISE PRI,44,TRUE,25304,28900
521,3214,1209 KG BAHRU RD PC NR ST TERESA'S CHURCH,41,,KG BAHRU RD PC NR ST TERESA'S CHURCH,36,TRUE,27485,28477
522,3215,0830 KG BAHRU RD PC NR SILAT AVE,32,,KG BAHRU RD PC NR SILAT AVE,27,TRUE,27627,28711
523,3216,2064 KG BAHRU RD PC NR BLK 102,30,,KG BAHRU RD PC NR BLK 102,25,TRUE,27302,28218
525,3218,2827 COLLEGE RD PC NR MACALISTER RD,35,,COLLEGE RD PC NR MACALISTER RD,30,TRUE,28057,29152
532,3241,0537 HENDERSON RD PC NR BT MERAH VIEW,37,,HENDERSON RD PC NR BT MERAH VIEW,32,TRUE,26588,29657
535,3244,1494 HENDERSON RD PC NR SCHOOL,30,,HENDERSON RD PC NR SCHOOL,25,TRUE,26675,29781
537,3252,1106 BT MERAH CTRL PC NR 117,28,,BT MERAH CTRL PC NR 117,23,TRUE,25979,29537
540,3263,1845 JLN BT MERAH PC NR BLK 1,29,,JLN BT MERAH PC NR BLK 1,24,TRUE,25219,29844
541,3264,2163 JLN BT MERAH PC NR REDHILL CLOSE,37,,JLN BT MERAH PC NR REDHILL CLOSE,32,TRUE,25987,29688
543,3273,0967 MEI CHIN RD PC NR BLK 165,30,,MEI CHIN RD PC NR BLK 165,25,TRUE,24478,30395
544,3274,1360 MEI CHIN RD PC NR PRI SCHOOL,33,,MEI CHIN RD PC NR PRI SCHOOL,28,TRUE,24553,30598
550,3294,1777 ALEXANDRA RD PC NR ALEXANDRA POINT,39,,ALEXANDRA RD PC NR ALEXANDRA POINT,34,TRUE,24580,28857
551,3311,0790 TIONG BAHRU RD PC NR BLK 1,31,,TIONG BAHRU RD PC NR BLK 1,26,TRUE,27940,29822
552,3312,0474 TIONG BAHRU RD PC NR BLK 5,31,,TIONG BAHRU RD PC NR BLK 5,26,TRUE,27811,29818
557,3317,2349 JLN MEMBINA PC NR SCHOOL,29,,JLN MEMBINA PC NR SCHOOL,24,TRUE,27324,29665
558,3319,2852 LOWER DELTA RD PC NR JLN BUKIT HO SWEE,43,,LOWER DELTA RD PC NR JLN BUKIT HO SWEE,38,TRUE,27131,30060
561,3323,0235 TIONG BAHRU RD PC NR REDHILL MRT STN,41,,TIONG BAHRU RD PC NR REDHILL MRT STN,36,TRUE,26172,30186
563,3325,2485 REDHILL RD PC NR E2I,25,,REDHILL RD PC NR E2I,20,TRUE,25970,30010
564,3326,2818 TIONG BAHRU RD PC NR DELTA SWIMMING COMPLEX,48,,TIONG BAHRU RD PC NR DELTA SWIMMING COMPLEX,43,TRUE,0,0
566,3412,0750 GANGES AVE PC NR 60,24,,GANGES AVE PC NR 60,19,TRUE,27452,30324
567,3413,0276 HAVELOCK RD PC NR BEO CRES,31,,HAVELOCK RD PC NR BEO CRES,26,TRUE,27427,30187
568,3414,2376 JLN BUKIT HO SWEE PC BLK 34,32,,JLN BUKIT HO SWEE PC BLK 34,27,TRUE,27614,29978
570,3431,0952 ALEXANDRA RD PC NR POST OFFICE,35,,ALEXANDRA RD PC NR POST OFFICE,30,TRUE,26479,30393
572,3433,2127 PRINCE CHARLES CRESCENT PC,31,,PRINCE CHARLES CRESCENT PC,26,TRUE,26382,30506
573,3434,2406 ALEXANDRA VIEW PC NR ASCENTIA SKY,38,,ALEXANDRA VIEW PC NR ASCENTIA SKY,33,TRUE,26169,30309
576,3442,0465 TANGLIN RD PC NR CHURCH,28,,TANGLIN RD PC NR CHURCH,23,TRUE,26078,30756
577,3443,0553 MARGARET DR PC,19,,MARGARET DR PC,14,TRUE,25796,30837
578,3444,2118 DAWSON RD PC NR PARK CONNECTOR,35,,DAWSON RD PC NR PARK CONNECTOR,30,TRUE,25476,30795
582,3461,0686 C'WEALTH AVE PC NR STRATHMORE AVE,38,,C'WEALTH AVE PC NR STRATHMORE AVE,33,TRUE,25051,30656
583,3462,0586 C'WEALTH AVE PC QUEENSTOWN THEATRE,39,,C'WEALTH AVE PC QUEENSTOWN THEATRE,34,TRUE,24811,31019
584,3463,0825 C'WEALTH AVE PC NR 42,26,,C'WEALTH AVE PC NR 42,21,TRUE,24630,31184
587,3472,0098 C'WEALTH AVE PC NR COMMONWEALTH MRT STN,44,,C'WEALTH AVE PC NR COMMONWEALTH MRT STN,39,TRUE,24232,31528
589,3476,1883 C'WEALTH DR PC C'WEALTH CLOSE,34,,C'WEALTH DR PC C'WEALTH CLOSE,29,TRUE,24155,31924
590,3477,1939 QUEENSWAY PC NR MEI CHIN RD,32,,QUEENSWAY PC NR MEI CHIN RD,27,TRUE,24427,30342
593,3482,2005 ALEXANDRA RD PC NR BLK 57,30,,ALEXANDRA RD PC NR BLK 57,25,TRUE,25547,30509
621,3612,0289 HOLLAND DR PC NR MARKET,28,,HOLLAND DR PC NR MARKET,23,TRUE,23559,32255
623,3621,0431 C'WEALTH AVE PC NR 7,25,,C'WEALTH AVE PC NR 7,20,TRUE,23690,32007
625,3623,0211 C'WEALTH DR PC NR TANGLIN HALT RD,38,,C'WEALTH DR PC NR TANGLIN HALT RD,33,TRUE,23998,31357
627,3625,2198 TANGLIN HALT PC NR BLK 88,30,,TANGLIN HALT PC NR BLK 88,25,TRUE,24036,31564
628,3626,2783 TANGLIN HALT RD PC NR NEW TOWN PRI SCH,43,,TANGLIN HALT RD PC NR NEW TOWN PRI SCH,38,TRUE,0,0
638,3653,1273 C'WEALTH AVE WEST PC NR POLY GATE 6,40,,C'WEALTH AVE WEST PC NR POLY GATE 6,35,TRUE,21524,32752
641,3661,0267 GHIM MOH RD PC NR BLK 10,29,,GHIM MOH RD PC NR BLK 10,24,TRUE,23134,32367
642,3662,0768 GHIM MOH RD PC NR 3,24,,GHIM MOH RD PC NR 3,19,TRUE,22917,32679
643,3663,0992 GHIM MOH RD PC NR GHIM MOH PRI SCH,39,,GHIM MOH RD PC NR GHIM MOH PRI SCH,34,TRUE,22753,32714
654,3733,0789 HOLLAND DR PC NR 22,24,,HOLLAND DR PC NR 22,19,TRUE,23470,32632
655,3734,3123 HOLLAND VILLAGE WAY PC NR HOLLAND VILLAGE,46,,HOLLAND VILLAGE WAY PC NR HOLLAND VILLAGE,41,TRUE,0,0
658,3743,1700 HOLLAND GROVE RD PC NR HENRY PARK PS,41,,HOLLAND GROVE RD PC NR HENRY PARK PS,36,TRUE,22430,33142
659,3751,0618 HOLLAND RD PC NR MOONBEAM WALK,35,,HOLLAND RD PC NR MOONBEAM WALK,30,TRUE,22305,33539
671,4111,1272 SUNSET WAY PC,18,,SUNSET WAY PC,13,TRUE,20850,33953
672,4112,1606 DOVER RD PC NR NEW TOWN SEC SCH,36,,DOVER RD PC NR NEW TOWN SEC SCH,31,TRUE,21323,32361
673,4113,2489 CLEMENTI AVE 2 SLIP RD PC (TOWARDS AYE CITY),49,,CLEMENTI AVE 2 SLIP RD PC (TOWARDS AYE CITY),44,TRUE,20547,32332
675,4121,0634 C'WEALTH AVE WEST PC NR 410,32,,C'WEALTH AVE WEST PC NR 410,27,TRUE,20934,32687
678,4124,2641  C'WEALTH AVE WEST PC NR 317,33,, C'WEALTH AVE WEST PC NR 317,28,TRUE,20516,32856
679,4125,2212 CLEMENTI AVE 1 PC NR 407,29,,CLEMENTI AVE 1 PC NR 407,24,TRUE,20787,32521
680,4127,2993 CLEMENTI AVE 1 PC NR NAN HUA HIGH SCH,42,,CLEMENTI AVE 1 PC NR NAN HUA HIGH SCH,37,TRUE,0,0
681,4131,0521 CLEMENTI AVE 5 PC NR PEI TONG PRI SCH,42,,CLEMENTI AVE 5 PC NR PEI TONG PRI SCH,37,TRUE,20675,33259
685,4135,1135 CLEMENTI AVE 3 PC NR 429,29,,CLEMENTI AVE 3 PC NR 429,24,TRUE,20229,32840
686,4137,2429 CLEMENTI AVE 3 PC NR BLK 427,33,,CLEMENTI AVE 3 PC NR BLK 427,28,TRUE,20332,32715
687,4138,2653 CLEMENTI AVE 3 PC NR BLK 453,33,,CLEMENTI AVE 3 PC NR BLK 453,28,TRUE,20457,32693
694,4149,2138 BOON LAY WAY PC SUNGEI PANDAN,34,,BOON LAY WAY PC SUNGEI PANDAN,29,TRUE,18628,34642
698,4161,2537 JLN LEMPENG PC NEAR PARK WEST,34,,JLN LEMPENG PC NEAR PARK WEST,29,TRUE,0,0
700,4202,0516 WEST COAST RD PC NR 513,28,,WEST COAST RD PC NR 513,23,TRUE,19834,32427
701,4203,0554 WEST COAST RD PC NR BLK 701,32,,WEST COAST RD PC NR BLK 701,27,TRUE,20101,32197
703,4205,0507 WEST COAST RD PC NR MARKET,31,,WEST COAST RD PC NR MARKET,26,TRUE,20403,31753
704,4206,0626 WEST COAST RD PC NR Kent Ridge Sec Sch,43,,WEST COAST RD PC NR Kent Ridge Sec Sch,38,TRUE,20517,31493
705,4207,1151 CLEMENTI WEST ST 2 PC,26,,CLEMENTI WEST ST 2 PC,21,TRUE,20122,31830
706,4208,2112 AYE SLIP RD PC CLEMENTI AVE 2,34,,AYE SLIP RD PC CLEMENTI AVE 2,29,TRUE,20522,32408
707,4211,2982 WEST COAST DR PC NR AYER RAJAH FOOD CENTRE,47,,WEST COAST DR PC NR AYER RAJAH FOOD CENTRE,42,TRUE,19836,32607
708,4218,3147 CLEMENTI AVE 1 PC NEAR CLAVON CONDO,40,,CLEMENTI AVE 1 PC NEAR CLAVON CONDO,35,TRUE,0,0
713,4305,1120 BOON LAY AVE PC NR BLK 260,31,,BOON LAY AVE PC NR BLK 260,26,TRUE,14078,36328
715,4307,0906 BOON LAY DR PC NR BLK 187,30,,BOON LAY DR PC NR BLK 187,25,TRUE,14261,36320
718,4321,0905 BOON LAY AVE PC NR CHURCH,30,,BOON LAY AVE PC NR CHURCH,25,TRUE,14359,36730
720,4323,0122 BOON LAY PLACE PC NR MARKET,32,,BOON LAY PLACE PC NR MARKET,27,TRUE,14649,36468
721,4324,1275 BOON LAY AVE PC 176,24,,BOON LAY AVE PC 176,19,TRUE,14322,36598
722,4325,1800 BOON LAY DR PC NR BOON LAY GDN PRI SCH,43,,BOON LAY DR PC NR BOON LAY GDN PRI SCH,38,TRUE,14422,36010
725,4328,2379 BOON LAY WAY PC NR BLK 200,31,,BOON LAY WAY PC NR BLK 200,26,TRUE,14654,36011
740,4345,0654 CORPORATION DR PC NR JURONG TOWN PRI SCH,45,,CORPORATION DR PC NR JURONG TOWN PRI SCH,40,TRUE,15743,34751
743,4348,1461 YUAN CHING RD PC NR JURONG SEC SCH,39,,YUAN CHING RD PC NR JURONG SEC SCH,34,TRUE,15927,34743
744,4349,1460 CORPORATION DR PC NR 357,29,,CORPORATION DR PC NR 357,24,TRUE,15506,35520
745,4350,1194 CORPORATION RD PC NR LAKEPOINT CONDO,41,,CORPORATION RD PC NR LAKEPOINT CONDO,36,TRUE,14954,35826
746,4351,1869 COPORATION DR PC NR LAKESIDE PRI SCH,41,,COPORATION DR PC NR LAKESIDE PRI SCH,36,TRUE,15157,35533
747,4352,2076 CORPORATION RD PC,22,,CORPORATION RD PC,17,TRUE,15054,35602
748,4353,3030 COPORATION DR PC LAKESIDE PR SCH,37,,COPORATION DR PC LAKESIDE PR SCH,32,TRUE,0,0
753,4401,0876 YUAN CHING RD PC NR 119,28,,YUAN CHING RD PC NR 119,23,TRUE,15954,35327
754,4402,0875 YUAN CHING RD PC NR YUNG AN PRI SCH,40,,YUAN CHING RD PC NR YUNG AN PRI SCH,35,TRUE,15578,35959
757,4405,0922 JURONG WEST ST 51 PC NR SHUQUN PRI SCH,43,,JURONG WEST ST 51 PC NR SHUQUN PRI SCH,38,TRUE,15462,36645
759,4407,1047 JURONG WEST ST 52 PC NR RULANG PRI SCH,43,,JURONG WEST ST 52 PC NR RULANG PRI SCH,38,TRUE,15300,36456
762,4410,2575 LAKESIDE DR PC NR LAKESIDE MRT STN,39,,LAKESIDE DR PC NR LAKESIDE MRT STN,34,TRUE,15405,36091
764,4412,0714 JURONG WEST AVE 1 PC NR 502,32,,JURONG WEST AVE 1 PC NR 502,27,TRUE,15199,36983
766,4414,0715 JURONG WEST AVE 1 PC NR BLK 457,36,,JURONG WEST AVE 1 PC NR BLK 457,31,TRUE,15489,37021
767,4415,0716 JURONG WEST AVE 1 PC NR 425,32,,JURONG WEST AVE 1 PC NR 425,27,TRUE,15847,36972
769,4418,0649 JURONG EAST AVE 1 PC NR 341,32,,JURONG EAST AVE 1 PC NR 341,27,TRUE,16597,36810
770,4419,0648 JURONG EAST AVE 1 PC NR BLK 345,36,,JURONG EAST AVE 1 PC NR BLK 345,31,TRUE,16713,36439
774,4423,2095 JURONG EAST ST 31 PC NR BLK 343,36,,JURONG EAST ST 31 PC NR BLK 343,31,TRUE,16517,36392
775,4424,2172 BOON LAY WY PC NR JURONG LAKE,34,,BOON LAY WY PC NR JURONG LAKE,29,TRUE,16163,36282
776,4425,2250 JURONG WEST ST 41 PC NR YUHUA SEC SCH,42,,JURONG WEST ST 41 PC NR YUHUA SEC SCH,37,TRUE,15748,36608
777,4426,2385 JURONG EAST ST 32 PC NR JURONG PRI SCH,43,,JURONG EAST ST 32 PC NR JURONG PRI SCH,38,TRUE,16760,36687
778,4428,3121 JURONG WEST ST 41 PC NR CANADIAN INT SCH,45,,JURONG WEST ST 41 PC NR CANADIAN INT SCH,40,TRUE,0,0
782,4504,1098 JALAN AHMAD IBRAHIM PC,27,,JALAN AHMAD IBRAHIM PC,22,TRUE,13990,33744
787,4514,1844 JLN BOON LAY PC WEILY CARPET,33,,JLN BOON LAY PC WEILY CARPET,28,TRUE,14192,34183
788,4515,1847 JLN BOON LAY PC ENTERPRISE RD,34,,JLN BOON LAY PC ENTERPRISE RD,29,TRUE,14111,34993
790,4517,2143 INTERNATIONAL RD PC,24,,INTERNATIONAL RD PC,19,TRUE,13698,34442
793,4700,1100 JLN AHMAD IBRAHIM PC NR PIONEER CIRCLE,43,,JLN AHMAD IBRAHIM PC NR PIONEER CIRCLE,38,TRUE,12939,33842
795,4702,2572 JLN AHMAD IBRAHIM PC PIONEER CIRCUS,40,,JLN AHMAD IBRAHIM PC PIONEER CIRCUS,35,TRUE,12578,33911
803,4731,2445 JOO KOON CIRCLE / BUS INTERCHANGE,38,Joo Koon Cir/Bus Interchange,JOO KOON CIRCLE / BUS INTERCHANGE,33,FALSE,10687,34443
804,4801,1698 JURONG WEST AVE 3/WEST ST 24,33,Jurong West Ave 3/West St 24,JURONG WEST AVE 3/WEST ST 24,28,FALSE,13673,37095
805,4802,1829 JURONG WEST AVE 3/WEST ST 22,33,Jurong West Ave 3/West St 22,JURONG WEST AVE 3/WEST ST 22,28,FALSE,13701,37349
806,4803,2471 BULIM AVE/BULIM DR,23,Bulim Ave/Bulim Dr,BULIM AVE/BULIM DR,18,FALSE,13870,37972
807,4804,2472 BULIM AVE/BULIM ST,23,Bulim Ave/Bulim St,BULIM AVE/BULIM ST,18,FALSE,14087,37683
808,4805,2473 BULIM AVE/BULIM AVE,24,Bulim Ave/Bulim Ave,BULIM AVE/BULIM AVE,19,FALSE,14271,37414
811,4811,2951 BULIM ST/BULIM GREEN,25,Bulim St/Bulim Green,BULIM ST/BULIM GREEN,20,FALSE,13935,37581
812,5000,*#1129 BUKIT TIMAH RD/NAMLY AVE,31,Bt Timah Rd/Namly Ave,BUKIT TIMAH RD/NAMLY AVE,24,FALSE,24518,34605
813,5099,2928 IRRAWADDY RD/TAN TOCK SENG LINK,36,Irrawaddy Rd/Tan Tock Seng Lk,IRRAWADDY RD/TAN TOCK SENG LINK,31,FALSE,29382,33958
814,5101,0655 BALESTIER RD/CTE (PHI),27,Balestier Rd/CTE,BALESTIER RD/CTE (PHI),22,FALSE,30330,33470
815,5102,0067 BALESTIER RD/MOULMEIN RD (PHI),35,Balestier Rd/Moulmein Rd,BALESTIER RD/MOULMEIN RD (PHI),30,FALSE,30202,33543
816,5103,*#0531 CTE/MOULMEIN RD (PHI),28,CTE/Moulmein Rd,CTE/MOULMEIN RD (PHI),21,FALSE,29975,33514
817,5104,*#0089 JLN TAN TOCK SENG/MOULMEIN RD,36,Jln Tan Tock Seng/Moulmein Rd,JLN TAN TOCK SENG/MOULMEIN RD,29,FALSE,29686,33471
820,5107,2280 IRRAWADDY RD/SINARAN DR,28,Irrawaddy Rd/Sinaran Dr,IRRAWADDY RD/SINARAN DR,23,FALSE,29200,33734
822,5109,2702 JLN TAN TOCK SENG/TAN TOCK SENG LK/BASSEIN RD,50,Jln Tan Tock Seng/Tan Tock Seng Lk,JLN TAN TOCK SENG/TAN TOCK SENG LK/BASSEIN RD,45,FALSE,29516,33921
824,5111,0560 BALESTIER RD/BOON TECK RD,30,Balestier Rd/Boon Teck Rd,BALESTIER RD/BOON TECK RD,25,FALSE,29767,34228
825,5112,0065 BALESTIER RD/KIM KEAT RD,29,Balestier Rd/Kim Keat Rd,BALESTIER RD/KIM KEAT RD,24,FALSE,30095,33963
826,5113,0070 BALESTIER RD/WHAMPOA DR,28,Balestier Rd/Whampoa Dr,BALESTIER RD/WHAMPOA DR,23,FALSE,30160,33876
830,5123,0853 WHAMPOA DR/WHAMPOA RD,26,Whampoa Dr/Whampoa Rd,WHAMPOA DR/WHAMPOA RD,21,FALSE,30708,34135
835,5128,1657 JLN BAHAGIA/JLN TENTERAM,29,Jln Bahagia/Jln Tenteram,JLN BAHAGIA/JLN TENTERAM,24,FALSE,30705,34446
837,5201,0381 THOMSON RD/MARYMOUNT RD,28,Thomson Rd/Marymount Rd,THOMSON RD/MARYMOUNT RD,23,FALSE,28470,35704
838,5202,*#0695 THOMSON RD/OLIVE RD/TOA PAYOH RISE,41,Thomson Rd/Olive Rd/Toa Payoh Rise,THOMSON RD/OLIVE RD/TOA PAYOH RISE,34,FALSE,28438,35581
839,5203,0336 THOMSON RD/WHITLEY RD/JLN TOA PAYOH,40,Thomson Rd/Whitley Rd/Jln Toa Payoh,THOMSON RD/WHITLEY RD/JLN TOA PAYOH,35,FALSE,28916,34350
840,5204,0069 THOMSON RD/BALESTIER RD,28,Thomson Rd/Balestier Rd,THOMSON RD/BALESTIER RD,23,FALSE,28946,34292
841,5205,*#0390 MOULMEIN RD/THOMSON RD,29,Moulmein Rd/Thomson Rd,MOULMEIN RD/THOMSON RD,22,FALSE,29180,33442
842,5207,1909 THOMSON RD/NOVENA RISE,27,Thomson Rd/Novena Rise,THOMSON RD/NOVENA RISE,22,FALSE,28957,34087
843,5208,2281 TOA PAYOH R/CALDECOTT MRT,30,Toa Payoh R/Caldecott Mrt,TOA PAYOH R/CALDECOTT MRT,25,FALSE,28695,35577
844,5210,3114 THOMSON RD/MT PLEASANT RD,30,Thomson Rd/Mt Pleasant Rd,THOMSON RD/MT PLEASANT RD,25,FALSE,28635,34779
846,5212,0573 BALESTIER RD/AH HOOD RD,28,Balestier Rd/Ah Hood Rd,BALESTIER RD/AH HOOD RD,23,FALSE,29277,34312
847,5213,1300 WHITLEY RD/THOMSON FLYOVER SLIP RD,39,Whitley Rd/Thomson Flyover Slip Rd,WHITLEY RD/THOMSON FLYOVER SLIP RD,34,FALSE,28661,34412
851,5226,2886 THOMSON RD/NEWTON RD,25,Thomson Rd/Newton Rd,THOMSON RD/NEWTON RD,20,FALSE,29101,33542
852,5302,0366 THOMSON RD/LORNIE RD/UPP THOMSON RD,40,Thomson Rd/Lornie Rd/Upp Thomson Rd,THOMSON RD/LORNIE RD/UPP THOMSON RD,35,FALSE,28277,36001
853,5303,0137 UPP THOMSON RD/BRADDELL RD/THOMSON RD,42,Upp Thomson Rd/Braddell Rd/Thomson Rd,UPP THOMSON RD/BRADDELL RD/THOMSON RD,37,FALSE,28584,36187
854,5304,2159 LORNIE RD/MACRITCHE RESERVOIR PARK,39,Lornie Rd/Macritche Res Park,LORNIE RD/MACRITCHE RESERVOIR PARK,34,FALSE,28219,35963
856,5311,*#0379 UPP THOMSON RD/MARYMOUNT LANE,36,Upp Thomson Rd/Marymount Ln,UPP THOMSON RD/MARYMOUNT LANE,29,FALSE,28497,36713
857,5312,*#0328 BISHAN ST 21/MARYMOUNT RD/LANE,37,Bishan St 21/Marymount Rd/Ln,BISHAN ST 21/MARYMOUNT RD/LANE,30,FALSE,28681,36718
858,5313,0828 BISHAN ST 21/JLN PEMIMPIN,30,Bishan St 21/Jln Pemimpin,BISHAN ST 21/JLN PEMIMPIN,25,FALSE,28806,36663
859,5314,0343 MARYMOUNT RD/SHUNFU RD,27,Marymount Rd/Shunfu Rd,MARYMOUNT RD/SHUNFU RD,22,FALSE,28750,37004
860,5315,1182 UPP THOMSON RD/JLN PELATINA,32,Upp Thomson Rd/Jln Pelatina,UPP THOMSON RD/JLN PELATINA,27,FALSE,28266,37066
861,5316,*#0337 UPP THOMSON RD/JLN TODAK/SIN MING RD,43,Upp Thomson Rd/Jln Todak/Sin Ming Rd,UPP THOMSON RD/JLN TODAK/SIN MING RD,36,FALSE,28151,37229
862,5317,*#1008 UPP THOMSON RD/SIN MING AVE/VENUS DR,43,Upp Thomson Rd/Sin Ming Ave/Venus Dr,UPP THOMSON RD/SIN MING AVE/VENUS DR,36,FALSE,27498,37943
863,5318,1804 MARYMOUNT LANE/BISHAN FIRE STN,35,Marymount Ln/Bishan Fire Stn,MARYMOUNT LANE/BISHAN FIRE STN,30,FALSE,28561,36747
865,5322,1184 SIN MING AVE/SIN MING WALK,31,Sin Ming Ave/Sin Ming Wk,SIN MING AVE/SIN MING WALK,26,FALSE,27984,38381
866,5324,0665 SIN MING AVE/SIN MING DR/SIN MING PLACE,44,Sin Ming Ave/Sin Ming Dr/Sin Ming Pl,SIN MING AVE/SIN MING DR/SIN MING PLACE,39,FALSE,28629,38236
867,5325,0532 SIN MING DR/SIN MING RD,28,Sin Ming Dr/Sin Ming Rd,SIN MING DR/SIN MING RD,23,FALSE,28442,37503
868,5326,1721 SIN MING AVE/BRIGHT HILL DR,32,Sin Ming Ave/Bright Hill Dr,SIN MING AVE/BRIGHT HILL DR,27,FALSE,27860,38043
870,5328,2004 SIN MING DR/SIN MING DR,28,Sin Ming Dr/Sin Ming Dr,SIN MING DR/SIN MING DR,23,FALSE,28546,38066
871,5329,2189 SIN MING DR/SIN MING LANE,30,Sin Ming Dr/Sin Ming Ln,SIN MING DR/SIN MING LANE,25,FALSE,28335,37572
873,5331,"3115 UPP THOMSON RD ""U""-TURN NR CHURCH",38,"Upp Thomson Rd ""U""-Turn Nr Church","UPP THOMSON RD ""U""-TURN NR CHURCH",33,FALSE,27964,37395
874,5340,3119 BRADDELL RD/MARYMOUNT RD,29,Braddell Rd/Marymount Rd,BRADDELL RD/MARYMOUNT RD,24,FALSE,28764,36283
876,5401,*#0545 CTE SLIP RD/BRADDELL RD,30,CTE Slip Rd/Braddell Rd,CTE SLIP RD/BRADDELL RD,23,FALSE,31023,36269
877,5402,*#0185 CTE/BRADDELL RD (TO CITY),32,CTE/Braddell Rd (To City),CTE/BRADDELL RD (TO CITY),25,FALSE,31042,36172
878,5411,0667 BISHAN RD/BRADDELL RD,26,Bishan Rd/Braddell Rd,BISHAN RD/BRADDELL RD,21,FALSE,29460,36210
879,5412,*#0838 BISHAN ST 21/BISHAN RD/ST 11,35,Bishan St 21/Bishan Rd/St 11,BISHAN ST 21/BISHAN RD/ST 11,28,FALSE,29553,36740
881,5414,*#0866 BISHAN ST 22/BISHAN RD/ST 14,35,Bishan St 22/Bishan Rd/St 14,BISHAN ST 22/BISHAN RD/ST 14,28,FALSE,29678,37304
884,5421,1040 BISHAN ST 22/ST 23,23,Bishan St 22/St 23,BISHAN ST 22/ST 23,18,FALSE,29469,37489
885,5422,1082 BISHAN ST 22/ST 24,23,Bishan St 22/St 24,BISHAN ST 22/ST 24,18,FALSE,29314,37736
890,5432,0936 BISHAN ST 13/ST 14,23,Bishan St 13/St 14,BISHAN ST 13/ST 14,18,FALSE,30117,36998
891,5433,1025 BISHAN ST 13/BUS INTERCHANGE,33,Bishan St 13/Bus Interchange,BISHAN ST 13/BUS INTERCHANGE,28,FALSE,29896,36912
895,5437,2158 BISHAN PLACE/TEMP RD,25,Bishan Pl/Temp Rd,BISHAN PLACE/TEMP RD,20,FALSE,29777,37033
896,5438,2364 BISHAN ST 14/ST 15/ ACCESS RD,34,Bishan St 14/St 15/ Access Rd,BISHAN ST 14/ST 15/ ACCESS RD,29,FALSE,29901,37256
897,5441,0822 BISHAN ST 11/ST 12/ST 13,29,Bishan St 11/St 12/St 13,BISHAN ST 11/ST 12/ST 13,24,FALSE,29827,36680
900,5444,0915 BISHAN ST 13/ST 11,23,Bishan St 13/St 11,BISHAN ST 13/ST 11,18,FALSE,30328,36458
911,5511,0746 LOR 7 TOA PAYOH/KIM KEAT AVE/TOA PAYOH EAST,48,Lor 7 Toa Payoh/Toa Payoh East,LOR 7 TOA PAYOH/KIM KEAT AVE/TOA PAYOH EAST,43,FALSE,30754,35158
912,5512,0477 LOR 6 TOA PAYOH/TOA PAYOH EAST,35,Lor 6 Toa Payoh/Toa Payoh East,LOR 6 TOA PAYOH/TOA PAYOH EAST,30,FALSE,30558,35159
914,5514,0361 LOR 6 TOA PAYOH/KIM KEAT LK,32,Lor 6 Toa Payoh/Kim Keat Lk,LOR 6 TOA PAYOH/KIM KEAT LK,27,FALSE,30379,34871
915,5515,0567 LOR 6/LOR 4 TOA PAYOH,26,Lor 6/Lor 4 Toa Payoh,LOR 6/LOR 4 TOA PAYOH,21,FALSE,30058,34827
916,5518,1553 LOR 6 TOA PAYOH/NEW BUS INTERCHANGE,40,Lor 6 Toa Payoh/New Bus Interchange,LOR 6 TOA PAYOH/NEW BUS INTERCHANGE,35,FALSE,29748,34821
917,5521,*#1171 LOR 1/LOR 2/LOR 6 TOA PAYOH,34,Lor 1/Lor 2/Lor 6 Toa Payoh,LOR 1/LOR 2/LOR 6 TOA PAYOH,27,FALSE,29442,34864
918,5522,0475 LOR 2 TOA PAYOH/CTRL,25,Lor 2 Toa Payoh/Ctrl,LOR 2 TOA PAYOH/CTRL,20,FALSE,29513,35156
920,5531,0484 LOR 7/LOR 6 TOA PAYOH,26,Lor 7/Lor 6 Toa Payoh,LOR 7/LOR 6 TOA PAYOH,21,FALSE,30271,35555
921,5532,*#0548 LOR 6/LOR 1 TOA PAYOH,28,Lor 6/Lor 1 Toa Payoh,LOR 6/LOR 1 TOA PAYOH,21,FALSE,30116,35699
922,5533,0547 LOR 1/LOR 4 TOA PAYOH,26,Lor 1/Lor 4 Toa Payoh,LOR 1/LOR 4 TOA PAYOH,21,FALSE,29978,35791
923,5534,0478 LOR 1/LOR 2 TOA PAYOH,26,Lor 1/Lor 2 Toa Payoh,LOR 1/LOR 2 TOA PAYOH,21,FALSE,29531,35893
924,5535,0480 LOR 1 TOA PAYOH/TOA PAYOH RISE,35,Lor 1 Toa Payoh/Toa Payoh Rise,LOR 1 TOA PAYOH/TOA PAYOH RISE,30,FALSE,29175,35664
925,5536,0479 LOR 1 TOA PAYOH/LOR 1A TOA PAYOH,37,Lor 1 Toa Payoh/Lor 1A Toa Payoh,LOR 1 TOA PAYOH/LOR 1A TOA PAYOH,32,FALSE,29133,35439
928,5539,1892 LOR 1 TOA PAYOH/TOA PAYOH NTH,34,Lor 1 Toa Payoh/Toa Payoh Nth,LOR 1 TOA PAYOH/TOA PAYOH NTH,29,FALSE,29690,35885
930,5541,0481 LOR 2/LOR 3 TOA PAYOH,26,Lor 2/Lor 3 Toa Payoh,LOR 2/LOR 3 TOA PAYOH,21,FALSE,29456,35640
932,5543,0483 LOR 4/LOR 5 TOA PAYOH (POLICE STATION,42,Lor 4/Lor 5 Toa Payoh (Police Station),LOR 4/LOR 5 TOA PAYOH (POLICE STATION,37,FALSE,29894,35649
933,5552,0476 LOR 4 TOA PAYOH/CTRL,25,Lor 4 Toa Payoh/Ctrl,LOR 4 TOA PAYOH/CTRL,20,FALSE,29996,35193
934,5553,0482 LOR 4/LOR 5 TOA PAYOH (THEATRE),36,Lor 4/Lor 5 Toa Payoh (Theatre),LOR 4/LOR 5 TOA PAYOH (THEATRE),31,FALSE,30018,35075
935,5555,2916 LOR 4 TOA PAYOH/LOR 3 TOA PAYOH,36,Lor 4 Toa Payoh/Lor 3 Toa Payoh,LOR 4 TOA PAYOH/LOR 3 TOA PAYOH,31,FALSE,29834,35531
938,5564,2972 TOA PAYOH EAST/TOH PAYOH IND PK/KIM KEAT AVE,49,Toa Payoh East/Toh Payoh Ind Pk,TOA PAYOH EAST/TOH PAYOH IND PK/KIM KEAT AVE,44,FALSE,30937,35156
939,5601,*#0154 SIXTH AVE/BUKIT TIMAH/DUNEARN RD,39,Sixth Ave/Bt Timah/Dunearn Rd,SIXTH AVE/BUKIT TIMAH/DUNEARN RD,32,FALSE,23791,34862
940,5602,*#0149 ENG NEO AVE/DUNEARN RD/BUKIT TIMAH RD,44,Eng Neo Ave/Dunearn Rd/Bt Timah Rd,ENG NEO AVE/DUNEARN RD/BUKIT TIMAH RD,37,FALSE,24057,34812
941,5603,*#0812 SIXTH AVE/JLN HAJI ALIAS,31,Sixth Ave/Jln Haji Alias,SIXTH AVE/JLN HAJI ALIAS,24,FALSE,23470,34130
942,5604,*#0230 DUNEARN RD/BINJAI PARK,29,Dunearn Rd/Binjai Park,DUNEARN RD/BINJAI PARK,22,FALSE,22780,35251
944,5606,1864 ENG NEO AVE/VANDA RD/VANDA LK,34,Eng Neo Ave/Vanda Rd/Vanda Lk,ENG NEO AVE/VANDA RD/VANDA LK,29,FALSE,24098,34949
945,5607,*#2000 SWISS CLUB RD/DUNEARN RD,31,Swiss Club Rd/Dunearn Rd,SWISS CLUB RD/DUNEARN RD,24,FALSE,23298,35075
946,5608,*#2268 BT TIMAH RD/DUNEARN RD/JLN JAMBAR AYER,45,Bt Timah Rd/Dunearn Rd/Jln Jambar Ayer,BT TIMAH RD/DUNEARN RD/JLN JAMBAR AYER,38,FALSE,22892,35179
947,5610,2481 TURF CLUB RD / VANDA LK,28,Turf Club Rd/Vanda Lk,TURF CLUB RD / VANDA LK,23,FALSE,23828,35037
948,5611,*#1055 ADAM RD/DUNEARN RD,25,Adam Rd/Dunearn Rd,ADAM RD/DUNEARN RD,18,FALSE,25777,34018
949,5613,*#1066 FARRER RD/EMPRESS RD NR FARRER RD MRT,44,Farrer Rd/Empress Rd Nr Farrer Rd Mrt,FARRER RD/EMPRESS RD NR FARRER RD MRT,37,FALSE,25048,33219
