FID,Site_ID,Ident,Ident_Len,Juction_Desc,OBU_Displa,Char_Count,Is_PC,Traffic_Light.Junction_X,Traffic_Light.Junction_Y
2056,14203,0903 BANGKIT RD/BT PANJANG RD,29,Bangkit Rd/Bt Panjang Rd,BANGKIT RD/BT PANJANG RD,24,FALSE,21327,39828
2057,14204,1401 BT PANJANG RD/BT PANJANG RG RD/JELEBU RD,45,Bt Panjang Rd/Jelebu Rd,BT PANJANG RD/BT PANJANG RG RD/JELEBU RD,40,FALSE,20227,40300
2058,14211,0901 BANGKIT RD/BT PANJANG RG RD,32,Bangkit Rd/Bt Panjang Rg Rd,BANGKIT RD/BT PANJANG RG RD,27,FALSE,21234,40148
2059,14212,0902 BT PANJANG RG RD/FAJAR RD,30,Bt Panjang Rg Rd/Fajar Rd,BT PANJANG RG RD/FAJAR RD,25,FALSE,21236,40342
2060,14213,1051 BT PANJANG RG RD/FAJAR RD/SEGAR RD,39,Bt Panjang Rg Rd/Fajar Rd/Segar Rd,BT PANJANG RG RD/FAJAR RD/SEGAR RD,34,FALSE,21154,40908
2061,14214,0742 FAJAR RD/SAUJANA RD,24,Fajar Rd/Saujana Rd,FAJAR RD/SAUJANA RD,19,FALSE,20871,40444
2062,14215,1399 BT PANJANG RG RD/JELAPANG RD,33,Bt Panjang Rg Rd/Jelapang Rd,BT PANJANG RG RD/JELAPANG RD,28,FALSE,20760,41140
2063,14216,1404 BT PANJANG RG RD/JELAPANG RD/SENJA LK,42,Bt Panjang Rg Rd/Jelapang Rd/Senja Lk,BT PANJANG RG RD/JELAPANG RD/SENJA LK,37,FALSE,20250,40861
2064,14217,1447 JELAPANG RD/SAUJANA RD,27,Jelapang Rd/Saujana Rd,JELAPANG RD/SAUJANA RD,22,FALSE,20483,40716
2065,14218,1514 BT PANJANG RG RD/SENJA RD NR BLK 601,41,Bt Panjang Rg Rd/Senja Rd Nr Blk 601,BT PANJANG RG RD/SENJA RD NR BLK 601,36,FALSE,20135,40492
2066,14219,1688 BT PANJANG RG RD/SENJA RD NR BLK 523,41,Bt Panjang Rg Rd/Senja Rd Nr Blk 523,BT PANJANG RG RD/SENJA RD NR BLK 523,36,FALSE,20434,41046
2070,14223,1702 SENJA RD/SENJA LINK,24,Senja Rd/Senja Lk,SENJA RD/SENJA LINK,19,FALSE,20162,40999
2079,14233,2790 SENJA CLOSE/SENJA LK,25,Senja Close/Senja Lk,SENJA CLOSE/SENJA LK,20,FALSE,20049,41155
2080,14235,2908 SENJA RD/SENJA FLYOVER,27,Senja Rd/Senja Flyover,SENJA RD/SENJA FLYOVER,22,FALSE,20261,41108
2081,14236,2907 SENJA FLYOVER/KJE,22,Senja Flyover/Kje,SENJA FLYOVER/KJE,17,FALSE,20321,41420
2082,14237,2909 KJE SERVICE RD/MINDEF ACCESS RD,36,Kje Service Rd/Mindef Access Rd,KJE SERVICE RD/MINDEF ACCESS RD,31,FALSE,20081,39196
2083,14238,2948 SENJA CLOSE/SENJA RD,25,Senja Close/Senja Rd,SENJA CLOSE/SENJA RD,20,FALSE,19902,40990
2084,14261,0817 GANGSA RD/PETIR RD,23,Gangsa Rd/Petir Rd,GANGSA RD/PETIR RD,18,FALSE,20534,39979
2085,14262,0818 PENDING RD/PETIR RD,24,Pending Rd/Petir Rd,PENDING RD/PETIR RD,19,FALSE,21007,39688
2086,14263,0869 CASHEW RD/PETIR RD,23,Cashew Rd/Petir Rd,CASHEW RD/PETIR RD,18,FALSE,21160,39594
2090,14267,1822 PETIR RD/CHESTNUT AVE,26,Petir Rd/Chestnut Ave,PETIR RD/CHESTNUT AVE,21,FALSE,21538,39116
2091,14268,1823 DAIRY FARM RD / DAIRY FARM HEIGHTS,39,Dairy Farm Rd/Dairy Farm Heights,DAIRY FARM RD / DAIRY FARM HEIGHTS,34,FALSE,21214,38518
2092,14269,2511 PETIR RD/DAIRY FARM WALK,29,Petir Rd/Dairy Farm Wk,PETIR RD/DAIRY FARM WALK,24,FALSE,21561,38763
2093,14271,1400 JELEBU RD/LOMPANG RD/BUS INTERCHANGE,41,Jelebu Rd/Lompang Rd/Bus Interchange,JELEBU RD/LOMPANG RD/BUS INTERCHANGE,36,FALSE,20318,40113
2094,14272,1403 PETIR RD/JELEBU RD,23,Petir Rd/Jelebu Rd,PETIR RD/JELEBU RD,18,FALSE,20365,40014
2095,14273,2142 PETIR RD/BUS INTERCHANGE,29,Petir Rd/Bus Interchange,PETIR RD/BUS INTERCHANGE,24,FALSE,20155,39961
2096,14282,2510 Dairy Farm Lane/Dairy Farm Walk,36,Dairy Farm Ln/Dairy Farm Wk,Dairy Farm Lane/Dairy Farm Walk,31,FALSE,21401,38799
2097,14283,2634 DAIRY FARM HEIGHTS/DAIRY FARM LANE,39,Dairy Farm Heights/Dairy Farm Ln,DAIRY FARM HEIGHTS/DAIRY FARM LANE,34,FALSE,21172,38694
2098,14301,0182 CHOA CHU KANG RD/TECK WHYE AVE,35,CCK Rd/Teck Whye Ave,CHOA CHU KANG RD/TECK WHYE AVE,30,FALSE,19426,39930
2099,14302,0878 CHOA CHU KANG RD/WY/BUKIT BATOK RD,39,CCK Rd/Wy/Bt Batok Rd,CHOA CHU KANG RD/WY/BUKIT BATOK RD,34,FALSE,19152,39807
2102,14305,1971 BT BATOK RD/SCDF BT BATOK FIRE STN,39,Bt Batok Rd/Scdf Bt Batok Fire Stn,BT BATOK RD/SCDF BT BATOK FIRE STN,34,FALSE,19031,39644
2103,14306,2203 CHOA CHU KANG WY/CHOA CHU KANG GROVE,41,CCK Wy/CCK Grove,CHOA CHU KANG WY/CHOA CHU KANG GROVE,36,FALSE,18977,39885
2104,14311,0988 CHOA CHU KANG AVE 1/CHOA CHU KANG WY,41,CCK Ave 1/CCK Wy,CHOA CHU KANG AVE 1/CHOA CHU KANG WY,36,FALSE,18569,40066
2105,14312,1089 CHOA CHU KANG AVE 2/CHOA CHU KANG WY,41,CCK Ave 2/CCK Wy,CHOA CHU KANG AVE 2/CHOA CHU KANG WY,36,FALSE,18186,40238
2106,14313,1092 CHOA CHU KANG AVE 3/CHOA CHU KANG WY,41,CCK Ave 3/CCK Wy,CHOA CHU KANG AVE 3/CHOA CHU KANG WY,36,FALSE,17985,40383
2107,14314,1084 CHOA CHU KANG AVE 4/CHOA CHU KANG WY,41,CCK Ave 4/CCK Wy,CHOA CHU KANG AVE 4/CHOA CHU KANG WY,36,FALSE,17902,40641
2108,14315,1095 CHOA CHU KANG AVE 4/LOOP (BUS INTERCH,42,CCK Ave 4/Loop (Bus Int),CHOA CHU KANG AVE 4/LOOP (BUS INTERCH,37,FALSE,18001,40670
2110,14319,2735 CHOA CHU KANG LOOP/NEW BUS INTERCHANGE,43,CCK Loop/New Bus Interchange,CHOA CHU KANG LOOP/NEW BUS INTERCHANGE,38,FALSE,18173,40927
2111,14320,1709 CHOA CHU KANG DR/LOOP,26,CCK Dr/Loop,CHOA CHU KANG DR/LOOP,21,FALSE,18297,40934
2112,14321,1158 CHOA CHU KANG AVE 4/CHOA CHU KANG DR,41,CCK Ave 4/CCK Dr,CHOA CHU KANG AVE 4/CHOA CHU KANG DR,36,FALSE,18320,40766
2113,14322,1094 CHOA CHU KANG AVE 3/CHOA CHU KANG DR,41,CCK Ave 3/CCK Dr,CHOA CHU KANG AVE 3/CHOA CHU KANG DR,36,FALSE,18392,40657
2114,14323,1109 CHOA CHU KANG AVE 3/CTRL/LOOP,34,CCK Ave 3/Ctrl/Loop,CHOA CHU KANG AVE 3/CTRL/LOOP,29,FALSE,18130,40478
2116,14325,1125 CHOA CHU KANG AVE 1/CHOA CHU KANG CTR,42,CCK Ave 1/CCK Ctr,CHOA CHU KANG AVE 1/CHOA CHU KANG CTR,37,FALSE,18640,40219
2118,14331,1030 CHOA CHU KANG AVE 1/DR/TECK WHYE AVE,41,CCK Ave 1/Dr/Teck Whye Ave,CHOA CHU KANG AVE 1/DR/TECK WHYE AVE,36,FALSE,18746,40456
2121,14334,1036 TECK WHYE AVE/JLN TECK WHYE,32,Teck Whye Ave/Jln Teck Whye,TECK WHYE AVE/JLN TECK WHYE,27,FALSE,19247,40329
2122,14335,1910 TECK WHYE CRES / TECK WHYE WALK,36,Teck Whye Cres/Teck Whye Wk,TECK WHYE CRES / TECK WHYE WALK,31,FALSE,19172,40470
2126,14342,1340 CHOA CHU KANG AVE 1/AVE 4,30,CCK Ave 1/Ave 4,CHOA CHU KANG AVE 1/AVE 4,25,FALSE,17396,40251
2127,14343,1093 CHOA CHU KANG AVE 1/CCK AVE 3,34,CCK Ave 1/CCK Ave 3,CHOA CHU KANG AVE 1/CCK AVE 3,29,FALSE,17520,40071
2129,14345,1467 CHOA CHU KANG AVE 1/AVE 2 / CCK TERRACE,44,CCK Ave 1/Ave 2/CCK Terrace,CHOA CHU KANG AVE 1/AVE 2 / CCK TERRACE,39,FALSE,17622,39916
2130,14346,1466 CHOA CHU KANG AVE 3/AVE 4/AVE 5,36,CCK Ave 3/Ave 4/Ave 5,CHOA CHU KANG AVE 3/AVE 4/AVE 5,31,FALSE,17296,39916
2136,14352,2393 CHOA CHU KANG AVE 5/AVE 6/KEAT HONG CLOSE,46,CCK Ave 5/Ave 6/Keat Hong Close,CHOA CHU KANG AVE 5/AVE 6/KEAT HONG CLOSE,41,FALSE,17829,39629
2137,14353,2394 CHOA CHU KANG AVE 1/AVE 6,30,CCK Ave 1/Ave 6,CHOA CHU KANG AVE 1/AVE 6,25,FALSE,17876,39799
2138,14354,2395 CHOA CHU KANG AVE 1/AVE 7/HONG SAN TERRACE,47,CCK Ave 1/Ave 7/Hong San Terrace,CHOA CHU KANG AVE 1/AVE 7/HONG SAN TERRACE,42,FALSE,18286,39873
2139,14355,2449 CHOA CHU KANG AVE 7 / KEAT HONG LINK,41,CCK Ave 7/Keat Hong Lk,CHOA CHU KANG AVE 7 / KEAT HONG LINK,36,FALSE,18339,39686
2141,14357,2451 CHOA CHU KANG AVE 7 / CHOA CHU KANG GROVE,46,CCK Ave 7/CCK Grove,CHOA CHU KANG AVE 7 / CHOA CHU KANG GROVE,41,FALSE,18516,39445
2143,14359,2453 CHOA CHU KANG GROVE / KEAT HONG LINK,41,CCK Grove/Keat Hong Lk,CHOA CHU KANG GROVE / KEAT HONG LINK,36,FALSE,18839,39713
2145,14401,1159 CHOA CHU KANG WY/KJE NR BT BATOK RD,40,CCK Wy/Kje Nr Bt Batok Rd,CHOA CHU KANG WY/KJE NR BT BATOK RD,35,FALSE,17814,40898
2146,14402,1160 CHOA CHU KANG WY/KJE,25,CCK Wy/Kje,CHOA CHU KANG WY/KJE,20,FALSE,17766,40999
2147,14403,1230 CHOA CHU KANG WY/NTH 5,27,CCK Wy/Nth 5,CHOA CHU KANG WY/NTH 5,22,FALSE,17754,41696
2148,14404,1235 CHOA CHU KANG WY/CHOA CHU KANG NTH 6,41,CCK Wy/CCK Nth 6,CHOA CHU KANG WY/CHOA CHU KANG NTH 6,36,FALSE,17930,42073
2149,14405,1314 CHOA CHU KANG WAY/NTH 7,28,CCK Wy/Nth 7,CHOA CHU KANG WAY/NTH 7,23,FALSE,18004,42593
2150,14406,1717 CHOA CHU KANG WAY/SUNGEI KADUT DR/AVE,42,CCK Wy/Sungei Kadut Dr/Ave,CHOA CHU KANG WAY/SUNGEI KADUT DR/AVE,37,FALSE,18333,43299
2151,14407,1961 CHOA CHU KANG WAY/KRANJI CAMP,34,CCK Wy/Kranji Camp,CHOA CHU KANG WAY/KRANJI CAMP,29,FALSE,18082,42797
2154,14411,1161 CHOA CHU KANG DR/KJE NR TECK WHYE AVE,42,CCK Dr/Kje Nr Teck Whye Ave,CHOA CHU KANG DR/KJE NR TECK WHYE AVE,37,FALSE,18258,41199
2155,14412,1162 CHOA CHU KANG DR/KJE,25,CCK Dr/Kje,CHOA CHU KANG DR/KJE,20,FALSE,18224,41304
2156,14413,1232 CHOA CHU KANG DR/NTH 5,27,CCK Dr/Nth 5,CHOA CHU KANG DR/NTH 5,22,FALSE,18182,41571
2157,14414,1237 CHOA CHU KANG DR/NTH 6,27,CCK Dr/Nth 6,CHOA CHU KANG DR/NTH 6,22,FALSE,18443,42029
2158,14415,1255 CHOA CHU KANG DR/CHOA CHU KANG ST 62,41,CCK Dr/CCK St 62,CHOA CHU KANG DR/CHOA CHU KANG ST 62,36,FALSE,18510,42266
2159,14416,1468 CHOA CHU KANG NTH 7/CHOA CHU KANG DR,41,CCK Nth 7/CCK Dr,CHOA CHU KANG NTH 7/CHOA CHU KANG DR,36,FALSE,18568,42484
2161,14418,1745 CHOA CHU KANG DR/CHOA CHU KANG CRES,40,CCK Dr/CCK Cres,CHOA CHU KANG DR/CHOA CHU KANG CRES,35,FALSE,18646,42762
2169,14431,1301 CHOA CHU KANG NTH 5/ST 51/ST 52,36,CCK Nth 5/St 51/St 52,CHOA CHU KANG NTH 5/ST 51/ST 52,31,FALSE,17914,41635
2171,14441,1233 CHOA CHU KANG NTH 5/CHOA CHU KANG ST,41,CCK Nth 5/CCK St,CHOA CHU KANG NTH 5/CHOA CHU KANG ST,36,FALSE,18421,41539
2172,14442,1298 CHOA CHU KANG NTH 5/ST 54,30,CCK Nth 5/St 54,CHOA CHU KANG NTH 5/ST 54,25,FALSE,18541,41553
2173,14443,1261 CHOA CHU KANG NTH 5/6/LK,29,CCK Nth 5/6/Lk,CHOA CHU KANG NTH 5/6/LK,24,FALSE,18954,41785
2176,14451,1236 CHOA CHU KANG NTH 6/ST 52/62,33,CCK Nth 6/St 52/62,CHOA CHU KANG NTH 6/ST 52/62,28,FALSE,18223,42064
2177,14452,1365 CHOA CHU KANG NTH 6/CHOA CHU KANG ST,41,CCK Nth 6/CCK St,CHOA CHU KANG NTH 6/CHOA CHU KANG ST,36,FALSE,18749,42026
2179,14461,1531 CHOA CHU KANG NTH 7/CHOA CHU KANG CRES,43,CCK Nth 7/CCK Cres,CHOA CHU KANG NTH 7/CHOA CHU KANG CRES,38,FALSE,18247,42547
2182,14501,1254 BRICKLANDS RD/KJE NR CHOA CHU KANG,39,Bricklands Rd/Kje Nr CCK,BRICKLANDS RD/KJE NR CHOA CHU KANG,34,FALSE,16833,40065
2183,14502,1253 SUNGEI TENGAH RD/KJE,25,Sungei Tengah Rd/Kje,SUNGEI TENGAH RD/KJE,20,FALSE,16765,40141
2184,14503,1260 SUNGEI TENGAH RD,21,Sungei Tengah Rd,SUNGEI TENGAH RD,16,FALSE,16623,40301
2185,14504,2075 CHOA CHU KANG AVE 3/BRICKLAND RD,37,CCK Ave 3/Brickland Rd,CHOA CHU KANG AVE 3/BRICKLAND RD,32,FALSE,17099,39784
2186,14505,2392 BRICKLAND RD/CHOA CHU KANG AVE 6,37,Brickland Rd/CCK Ave 6,BRICKLAND RD/CHOA CHU KANG AVE 6,32,FALSE,17760,39411
2187,14506,2448 BRICKLAND RD / CHOA CHU KANG GROVE,39,Brickland Rd/CCK Grove,BRICKLAND RD / CHOA CHU KANG GROVE,34,FALSE,18317,39224
2188,14601,0653 OLD CHOA CHU KANG RD/TENGAH AIRBASE,40,Old CCK Rd/Tengah Airbase,OLD CHOA CHU KANG RD/TENGAH AIRBASE,35,FALSE,14109,39180
2189,14602,0181 OLD CHOA CHU KANG RD/JLN BAHAR/LCK RD,42,Old CCK Rd/Jln Bahar/Lck Rd,OLD CHOA CHU KANG RD/JLN BAHAR/LCK RD,37,FALSE,12619,39546
2192,14605,2322 OLD CHOA CHU KANG RD/ARMY LOGISTIC BASE,44,Old CCK Rd/Army Logistic Base,OLD CHOA CHU KANG RD/ARMY LOGISTIC BASE,39,FALSE,15305,39607
2194,14611,0837 LIM CHU KANG RD/OLD LIM CHU KANG RD,40,Lim Chu Kang Rd/Old Lim Chu Kang Rd,LIM CHU KANG RD/OLD LIM CHU KANG RD,35,FALSE,12782,40152
2195,14612,0590 JLN GEMALA/LIM CHU KANG RD/SUNGEI GEDONG RD,48,Lim Chu Kang Rd/Sungei Gedong Rd,JLN GEMALA/LIM CHU KANG RD/SUNGEI GEDONG RD,43,FALSE,13338,44426
2196,14614,2315 LIM CHU KANG RD/LOR RUSUK,30,Lim Chu Kang Rd/Lor Rusuk,LIM CHU KANG RD/LOR RUSUK,25,FALSE,12884,40751
2197,14701,1734 DAIRY FARM EXTN/BKE SLIP RD,32,Dairy Farm Extn/BKE Slip Rd,DAIRY FARM EXTN/BKE SLIP RD,27,FALSE,22013,38600
2198,14702,1827 DAIRY FARM RD/PETIR RD,27,Dairy Farm Rd/Petir Rd,DAIRY FARM RD/PETIR RD,22,FALSE,21789,38562
2200,14802,2872 TENGAH DR / TENGAH BLVD,28,Tengah Dr/Tengah Blvd,TENGAH DR / TENGAH BLVD,23,FALSE,17054,38096
2202,14812,2876 PLANTATION CRES/TENGAH LK,30,Plantation Cres/Tengah Lk,PLANTATION CRES/TENGAH LK,25,FALSE,17096,37472
2203,14814,2873 TENGAH BLVD/PLANTATION CRES,32,Tengah Blvd/Plantation Cres,TENGAH BLVD/PLANTATION CRES,27,FALSE,16780,37822
2204,14816,2934 PLANTATION CRESCENT/TENGAH GARDEN WALK,43,Plantation Cres/Tengah Garden Wk,PLANTATION CRESCENT/TENGAH GARDEN WALK,38,FALSE,16558,38052
2208,14823,2875 TENGAH GARDEN AVE/TENGAH BLVD,34,Tengah Garden Ave/Tengah Blvd,TENGAH GARDEN AVE/TENGAH BLVD,29,FALSE,16546,37589
2211,14832,3056 TENGAH BLVD/TENGAH PARK AVE,32,Tengah Blvd/Tengah Park Ave,TENGAH BLVD/TENGAH PARK AVE,27,FALSE,17287,38330
2212,14843,3142 TENGAH BOULEVARD / TENGAH BUS INTERCHANGE,46,Tengah Blvd/Tengah Bus Interchange,TENGAH BOULEVARD / TENGAH BUS INTERCHANGE,41,FALSE,17203,38247
2213,15101,1415 PUNGGOL RD/SENGKANG EAST AVE,33,Punggol Rd/Sengkang East Ave,PUNGGOL RD/SENGKANG EAST AVE,28,FALSE,35254,40540
2215,15103,1412 PUNGGOL RD/COMPASSVALE DR/RIVERVALE LANE,45,Punggol Rd/Compassvale Dr/Rivervale Ln,PUNGGOL RD/COMPASSVALE DR/RIVERVALE LANE,40,FALSE,35603,40910
2216,15104,1411 PUNGGOL RD/SENGKANG EAST WY,32,Punggol Rd/Sengkang East Wy,PUNGGOL RD/SENGKANG EAST WY,27,FALSE,35590,41440
2217,15105,1410 PUNGGOL RD/COMPASSVALE ST/RIVERVALE DR,43,Punggol Rd/Compassvale St/Rivervale Dr,PUNGGOL RD/COMPASSVALE ST/RIVERVALE DR,38,FALSE,35583,41784
2218,15106,1390 PUNGGOL RD/TPE SLIP RD TO HOUGANG,38,Punggol Rd/TPE Slip Rd To Hougang,PUNGGOL RD/TPE SLIP RD TO HOUGANG,33,FALSE,35798,42041
2219,15107,1391 PUNGGOL RD/TPE SLIP RD TO PUNGGOL END,42,Punggol Rd/TPE Slip Rd To Punggol End,PUNGGOL RD/TPE SLIP RD TO PUNGGOL END,37,FALSE,35841,42130
2222,15110,1624 HOUGANG AVE 10/PUNGGOL RD/BUANGKOK DR,42,Hougang Ave 10/Punggol Rd/Buangkok Dr,HOUGANG AVE 10/PUNGGOL RD/BUANGKOK DR,37,FALSE,35076,40148
2223,15111,1482 RIVERVALE DR/RIVERVALE LANE,32,Rivervale Dr/Rivervale Ln,RIVERVALE DR/RIVERVALE LANE,27,FALSE,35765,40838
2224,15112,1484 SENGKANG EAST WAY/RIVERVALE DR (PHI),41,Sengkang East Wy/Rivervale Dr,SENGKANG EAST WAY/RIVERVALE DR (PHI),36,FALSE,36089,41169
2225,15113,1575 RIVERVALE DR/RIVERVALE CRESCENT,36,Rivervale Dr/Rivervale Cres,RIVERVALE DR/RIVERVALE CRESCENT,31,FALSE,36013,41554
2229,15118,2014 SENGKANG EAST WAY/RIVERVALE CRESCENT,41,Sengkang East Wy/Rivervale Cres,SENGKANG EAST WAY/RIVERVALE CRESCENT,36,FALSE,35909,41311
2230,15120,1837 SENGKANG CENTRAL/SENGKANG EAST AVE,39,Sengkang Ctrl/Sengkang East Ave,SENGKANG CENTRAL/SENGKANG EAST AVE,34,FALSE,34733,40953
2231,15121,1509 SENGKANG EAST AVE/COMPASSVALE LANE,39,Sengkang East Ave/Compassvale Ln,SENGKANG EAST AVE/COMPASSVALE LANE,34,FALSE,35078,40722
2232,15122,1508 COMPASSVALE DR/LANE/WALK,29,Compassvale Dr/Ln/Wk,COMPASSVALE DR/LANE/WALK,24,FALSE,35401,40980
2235,15131,1506 COMPASSVALE RD/DR,22,Compassvale Rd/Dr,COMPASSVALE RD/DR,17,FALSE,35048,41104
2236,15132,1507 COMPASSVALE RD/WALK/SENGKANG SQUARE,40,Compassvale Rd/Wk/Sengkang Square,COMPASSVALE RD/WALK/SENGKANG SQUARE,35,FALSE,35115,41299
2237,15133,1567 SENGKANG EAST WAY/COMPASSVALE RD,37,Sengkang East Wy/Compassvale Rd,SENGKANG EAST WAY/COMPASSVALE RD,32,FALSE,35194,41529
2238,15134,1566 COMPASSVALE RD/COMPASSVALE ST/CRESCENT,43,Compassvale Rd/Compassvale St/Cres,COMPASSVALE RD/COMPASSVALE ST/CRESCENT,38,FALSE,35317,41872
2239,15135,1568 SENGKANG EAST AVE/COMPASSVALE RD/LK,40,Sengkang East Ave/Compassvale Rd/Lk,SENGKANG EAST AVE/COMPASSVALE RD/LK,35,FALSE,34949,40855
2242,15141,1579 SENGKANG EAST AVE/RIVERVALE LINK (PHI,42,Sengkang East Ave/Rivervale Lk (Phi,SENGKANG EAST AVE/RIVERVALE LINK (PHI,37,FALSE,35406,40421
2243,15142,1580 SENGKANG EAST AVE/RIVERVALE DR (PHI),41,Sengkang East Ave/Rivervale Dr,SENGKANG EAST AVE/RIVERVALE DR (PHI),36,FALSE,35610,40389
2244,15143,1769 BUANGKOK DR/RIVERVALE LINK,31,Buangkok Dr/Rivervale Lk,BUANGKOK DR/RIVERVALE LINK,26,FALSE,35380,40192
2245,15144,1774 SENGKANG EAST DR/BUANGKOK DR/UPP SERA,42,Sengkang East Dr/Buangkok Dr/Upp Sera,SENGKANG EAST DR/BUANGKOK DR/UPP SERA,37,FALSE,35817,40258
2246,15145,2124 UPP SERANGOON RD/UPP SERANGOON VIEW,40,Upp Serangoon Rd/Upp Serangoon View,UPP SERANGOON RD/UPP SERANGOON VIEW,35,FALSE,35452,39616
2247,15146,2324 UPP SERANGOON RD/VIEW/CRES,31,Upp Serangoon Rd/View/Cres,UPP SERANGOON RD/VIEW/CRES,26,FALSE,35747,39923
2248,15151,1785 SENGKANG SQ NR COMPASSVALE RD,34,Sengkang Sq Nr Compassvale Rd,SENGKANG SQ NR COMPASSVALE RD,29,FALSE,35007,41340
2249,15152,1788 SENGKANG SQ NR SENGKANG EAST RD,36,Sengkang Sq Nr Sengkang East Rd,SENGKANG SQ NR SENGKANG EAST RD,31,FALSE,34762,41425
2250,15153,1836 COMPASSVALE DR/SENGKANG CTRL,33,Compassvale Dr/Sengkang Ctrl,COMPASSVALE DR/SENGKANG CTRL,28,FALSE,34805,41188
2251,15154,1841 SENGKANG SQ/BUS INTERCHANGE,32,Sengkang Sq/Bus Interchange,SENGKANG SQ/BUS INTERCHANGE,27,FALSE,35044,41454
2253,15161,1789 SENGKANG EAST WAY/SENGKANG EAST DR,39,Sengkang East Wy/Sengkang East Dr,SENGKANG EAST WAY/SENGKANG EAST DR,34,FALSE,36255,40935
2254,15162,1793 SENGKANG EAST DR/SENGKANG EAST AVE,39,Sengkang East Dr/Sengkang East Ave,SENGKANG EAST DR/SENGKANG EAST AVE,34,FALSE,35797,40412
2255,15201,1625 HOUGANG AVE 6/BUANGKOK DR/SENGKANG CT,42,Hougang Ave 6/Buangkok Dr/Sengkang Ct,HOUGANG AVE 6/BUANGKOK DR/SENGKANG CT,37,FALSE,34625,40223
2256,15202,1016 HOUGANG AVE 8/AVE 6,24,Hougang Ave 8/Ave 6,HOUGANG AVE 8/AVE 6,19,FALSE,34620,39866
2257,15203,0773 HOUGANG AVE 8/AVE 10,25,Hougang Ave 8/Ave 10,HOUGANG AVE 8/AVE 10,20,FALSE,34998,39811
2259,15205,0620 HOUGANG AVE 7/AVE 8/UPP SERANGOON RD,41,Hougang Ave 7/Ave 8/Upp Serangoon Rd,HOUGANG AVE 7/AVE 8/UPP SERANGOON RD,36,FALSE,35348,39515
2260,15207,1946 COMPASSVALE BOW/SENGKANG CTRL,34,Compassvale Bow/Sengkang Ctrl,COMPASSVALE BOW/SENGKANG CTRL,29,FALSE,34641,40384
2261,15208,1947 COMPASSVALE BOW/LK,23,Compassvale Bow/Lk,COMPASSVALE BOW/LK,18,FALSE,34856,40387
2266,15213,0744 HOUGANG AVE 8/AVE 4,24,Hougang Ave 8/Ave 4,HOUGANG AVE 8/AVE 4,19,FALSE,33855,39342
2267,15214,0916 HOUGANG AVE 8/ST 61,24,Hougang Ave 8/St 61,HOUGANG AVE 8/ST 61,19,FALSE,34048,39579
2268,15215,1078 HOUGANG AVE 8/ST 52,24,Hougang Ave 8/St 52,HOUGANG AVE 8/ST 52,19,FALSE,34293,39765
2270,15217,3072 SENGKANG CTRL/SENGKANG BUS INT,35,Sengkang Ctrl/Sengkang Bus Int,SENGKANG CTRL/SENGKANG BUS INT,30,FALSE,34660,40686
2272,15221,1481 HOUGANG AVE 9/HOUGANG ST 91,32,Hougang Ave 9/Hougang St 91,HOUGANG AVE 9/HOUGANG ST 91,27,FALSE,33211,39670
2273,15222,1483 HOUGANG AVE 9/HOUGANG ST 92,32,Hougang Ave 9/Hougang St 92,HOUGANG AVE 9/HOUGANG ST 92,27,FALSE,33376,39662
2274,15223,1103 HOUGANG AVE 4/AVE 9/ST 61,30,Hougang Ave 4/Ave 9/St 61,HOUGANG AVE 4/AVE 9/ST 61,25,FALSE,33761,39637
2280,15231,1648 HOUGANG ST 91/HOUGANG ST 93,32,Hougang St 91/Hougang St 93,HOUGANG ST 91/HOUGANG ST 93,27,FALSE,33369,39893
2282,15233,1375 HOUGANG AVE 4/HOUGANG ST 51/HOUGANG ST 91,46,Hougang Ave 4/St 51/St 91,HOUGANG AVE 4/HOUGANG ST 51/HOUGANG ST 91,41,FALSE,33706,39909
2283,15234,1384 HOUGANG ST 51/ST 52,24,Hougang St 51/St 52,HOUGANG ST 51/ST 52,19,FALSE,34194,39941
2288,15242,1649 HOUGANG ST 93/BUANGKOK GREEN,33,Hougang St 93/Buangkok Green,HOUGANG ST 93/BUANGKOK GREEN,28,FALSE,33358,40127
2289,15244,1581 HOUGANG AVE 4/BUANGKOK GREEN/VIEW,38,Hougang Ave 4/Buangkok Green/View,HOUGANG AVE 4/BUANGKOK GREEN/VIEW,33,FALSE,33700,40146
2290,15245,1179 HOUGANG ST 51/BUANGKOK GREEN,33,Hougang St 51/Buangkok Green,HOUGANG ST 51/BUANGKOK GREEN,28,FALSE,34021,40284
2291,15246,1652 BUANGKOK GREEN/BUANGKOK DR/SENGKANG EAST,45,Buangkok Dr/Sengkang East Rd,BUANGKOK GREEN/BUANGKOK DR/SENGKANG EAST,40,FALSE,34159,40450
2292,15247,2155 SENGKANG EAST RD/COMPASSVALE BOW,37,Sengkang East Rd/Compassvale Bow,SENGKANG EAST RD/COMPASSVALE BOW,32,FALSE,34330,40658
2293,15248,2585 BUANGKOK DR/BUANGKOK LK,28,Buangkok Dr/Buangkok Lk,BUANGKOK DR/BUANGKOK LK,23,FALSE,33711,40832
2294,15251,1764 BUANGKOK DR NR SENGKANG FIRE STATION,41,Buangkok Dr Nr Sengkang Fire Station,BUANGKOK DR NR SENGKANG FIRE STATION,36,FALSE,34906,40206
2295,15261,1783 BUANGKOK LINK/BUANGKOK CRES,32,Buangkok Lk/Buangkok Cres,BUANGKOK LINK/BUANGKOK CRES,27,FALSE,33355,40308
2296,15262,2419 BUANGKOK LINK/BUANGKOK CRES,32,Buangkok Lk/Buangkok Cres,BUANGKOK LINK/BUANGKOK CRES,27,FALSE,33564,40671
2297,15301,1651 SENGKANG EAST RD/COMPASSVALE DR/ANCHORVALE DR,50,Sengkang East Rd/Compassvale Dr,SENGKANG EAST RD/COMPASSVALE DR/ANCHORVALE DR,45,FALSE,34567,41271
2298,15302,1656 SENGKANG EAST RD/SENGKANG EAST WAY,39,Sengkang East Rd/Sengkang East Wy,SENGKANG EAST RD/SENGKANG EAST WAY,34,FALSE,34714,41694
2299,15303,1739 SENGKANG EAST AVE/EAST ROAD,32,Sengkang East Ave/East Rd,SENGKANG EAST AVE/EAST ROAD,27,FALSE,34456,40950
2300,15304,1790 SENGKANG SQ/SENGKANG EAST RD,33,Sengkang Sq/Sengkang East Rd,SENGKANG SQ/SENGKANG EAST RD,28,FALSE,34636,41469
2301,15305,1813 SENGKANG EAST RD/ANCHORVALE ST,35,Sengkang East Rd/Anchorvale St,SENGKANG EAST RD/ANCHORVALE ST,30,FALSE,34818,41993
2302,15306,1900 SENGKANG EAST RD/PUNGGOL WAY/TPE SLIP,42,Sengkang East Rd/Punggol Wy/TPE Slip,SENGKANG EAST RD/PUNGGOL WAY/TPE SLIP,37,FALSE,34993,42482
2303,15307,1899 SENGKANG EAST RD/TPE SLIP RD,33,Sengkang East Rd/TPE Slip Rd,SENGKANG EAST RD/TPE SLIP RD,28,FALSE,34955,42368
2304,15311,1677 ANCHORVALE RD/DR/LANE,26,Anchorvale Rd/Dr/Ln,ANCHORVALE RD/DR/LANE,21,FALSE,33927,41521
2305,15312,1691 ANCHORVALE DR/LINK,23,Anchorvale Dr/Lk,ANCHORVALE DR/LINK,18,FALSE,34249,41380
1805,12243,0860 TAMPINES AVE 3 PC NR 827,29,,TAMPINES AVE 3 PC NR 827,24,TRUE,39252,36871
1806,12244,1285 TAMPINES ST 83 PC NR 865,29,,TAMPINES ST 83 PC NR 865,24,TRUE,39278,37309
1809,12247,1643 TAMPINES AVE 3 PC NR BLK 888,33,,TAMPINES AVE 3 PC NR BLK 888,28,TRUE,38876,37040
1810,12248,1642 TAMPINES AVE 8 PC NR BLK 871A,34,,TAMPINES AVE 8 PC NR BLK 871A,29,TRUE,38919,37377
1811,12249,2744 TAMPINES ST 86 PC NR BLK 879,33,,TAMPINES ST 86 PC NR BLK 879,28,TRUE,38919,37377
1820,12259,1523 TAMPINES AVE 8 PC NR SPRINGFIELD SEC,41,,TAMPINES AVE 8 PC NR SPRINGFIELD SEC,36,TRUE,38688,36951
1831,12272,1207 TAMPINES AVE 9 PC NR 484,29,,TAMPINES AVE 9 PC NR 484,24,TRUE,41261,38243
1834,12275,1473 TAMPINES AVE 9 PC NR 485A,30,,TAMPINES AVE 9 PC NR 485A,25,TRUE,41594,38026
1841,12287,2903 TAMPINES NTH DR 1 PC NR BLK 609,36,,TAMPINES NTH DR 1 PC NR BLK 609,31,TRUE,39136,39427
1842,12291,3044 TAMPINES ST 86 PC NR BLK 872A,34,,TAMPINES ST 86 PC NR BLK 872A,29,TRUE,0,0
1843,12311,2157 PIE SLIP RD PC NR TAMPINES ST 31,37,,PIE SLIP RD PC NR TAMPINES ST 31,32,TRUE,41664,36876
1857,12514,2122 TAMPINES NORTH DR 2 PC NR IKEA,35,,TAMPINES NORTH DR 2 PC NR IKEA,30,TRUE,39034,39472
1865,12535,2906 TAMPINES ST 64 PC NR PARK,30,,TAMPINES ST 64 PC NR PARK,25,TRUE,0,0
1866,12536,2904 TAMPINES NTH DR 1 PC NR ST 64,34,,TAMPINES NTH DR 1 PC NR ST 64,29,TRUE,0,0
1869,12543,2723 TAMPINES NTH DR 2 PC NR BLK 636C,37,,TAMPINES NTH DR 2 PC NR BLK 636C,32,TRUE,39792,38663
1870,12544,2724 TAMPINES ST 62 PC NR BLK 647A,34,,TAMPINES ST 62 PC NR BLK 647A,29,TRUE,40115,38724
1874,12603,2864 TAMPINES ED SPC NR BUANGKOK EAST DR,40,,TAMPINES ED SPC NR BUANGKOK EAST DR,35,TRUE,37044,40051
1875,12604,2865 TAMPINES RD SPC NR TAMPINES IND DR,39,,TAMPINES RD SPC NR TAMPINES IND DR,34,TRUE,36975,39956
1880,13105,2249 MANDAI RD PC,17,,MANDAI RD PC,12,TRUE,23173,43833
1883,13108,2887 MANDAI AVE LP76 PC NR MANDAI CREMATORIUM,45,,MANDAI AVE LP76 PC NR MANDAI CREMATORIUM,40,TRUE,25416,44137
1889,13205,1006 WOODLANDS AVE 3 PC NR 320,30,,WOODLANDS AVE 3 PC NR 320,25,TRUE,21822,45997
1895,13214,0619 WOODLANDS AVE 1 PC NR FUCHUN PRI SCH,41,,WOODLANDS AVE 1 PC NR FUCHUN PRI SCH,36,TRUE,21841,45655
1896,13215,1779 WOODLANDS AVE 1 PC BLK 371,31,,WOODLANDS AVE 1 PC BLK 371,26,TRUE,22741,45942
1898,13217,1903 WOODLANDS AVE 1 PC BLK 541,31,,WOODLANDS AVE 1 PC BLK 541,26,TRUE,23557,45457
1901,13221,1064 WOODLANDS CENTRE RD PC NR MARSILING PRI SCH,48,,WOODLANDS CENTRE RD PC NR MARSILING PRI SCH,43,TRUE,21217,46303
1907,13232,0861 WOODLANDS CTR RD PC NR TOWN CENTRE,39,,WOODLANDS CTR RD PC NR TOWN CENTRE,34,TRUE,20883,47154
1912,13244,2794 WOODLANDS ST 13 PC NC BLK 146,34,,WOODLANDS ST 13 PC NC BLK 146,29,TRUE,21431,46454
1925,13323,1706 WOODLANDS SQ PC NR (TEL) MRT,33,,WOODLANDS SQ PC NR (TEL) MRT,28,TRUE,22900,46509
1926,13324,1705 WOODLANDS SQ PC NR CAUSEWAY POINT,38,,WOODLANDS SQ PC NR CAUSEWAY POINT,33,TRUE,22825,46390
1927,13325,1870 WOODLANDS SQUARE PC NEAR TEMP BUS INTERCHANGE,50,,WOODLANDS SQUARE PC NEAR TEMP BUS INTERCHANGE,45,TRUE,22597,46506
1929,13401,1328 WOODLANDS DR 50 PC NR 893A,31,,WOODLANDS DR 50 PC NR 893A,26,TRUE,23283,46480
1930,13402,1355 WOODLANDS ST 81 PC NR BLK 822,34,,WOODLANDS ST 81 PC NR BLK 822,29,TRUE,23087,47051
1931,13403,1330 WOODLANDS CIRCLE PC NR 741,31,,WOODLANDS CIRCLE PC NR 741,26,TRUE,23798,47282
1933,13405,1329 WOODLANDS CIRCLE PC NR 726,31,,WOODLANDS CIRCLE PC NR 726,26,TRUE,24238,47195
1935,13407,1454 WOODLANDS DR 14 PC,23,,WOODLANDS DR 14 PC,18,TRUE,23149,46093
1936,13408,1520 WOODLANDS ST PC 82 NR BLK 883,34,,WOODLANDS ST PC 82 NR BLK 883,29,TRUE,23230,47110
1938,13410,1982 WOODLANDS DR 50 PC NR WOODLANDS PRI SCH,44,,WOODLANDS DR 50 PC NR WOODLANDS PRI SCH,39,TRUE,23372,46573
1945,13417,2006 GAMBAS AVE PC NR 3M FACTORY,32,,GAMBAS AVE PC NR 3M FACTORY,27,TRUE,25380,47410
1953,13426,1518 WOODLANDS AVE 4 PC BLK 747,31,,WOODLANDS AVE 4 PC BLK 747,26,TRUE,23656,47197
1955,13429,2773 WOODLANDS DR 17 PC NR INNOVA PRI SCH,41,,WOODLANDS DR 17 PC NR INNOVA PRI SCH,36,TRUE,23170,45570
1957,13432,1357 WOODLANDS AVE 6 PC NR BLK 787B,35,,WOODLANDS AVE 6 PC NR BLK 787B,30,TRUE,24344,47365
1959,13434,1760 WOODLANDS DR 62 PC SCH,27,,WOODLANDS DR 62 PC SCH,22,TRUE,24854,46801
1965,13440,2407 WOODLANDS DR 64 PC NR SPECTRA SEC SCH,42,,WOODLANDS DR 64 PC NR SPECTRA SEC SCH,37,TRUE,24899,46526
1973,13450,3101 WOODLANDS AVE 5 SPC NR BLK 619,35,,WOODLANDS AVE 5 SPC NR BLK 619,30,TRUE,0,0
1974,13451,1440 WOODLANDS RG RD PC NR DR 65,32,,WOODLANDS RG RD PC NR DR 65,27,TRUE,24377,46348
1975,13452,1441 WOODLANDS RG RD PC BLK 662,31,,WOODLANDS RG RD PC BLK 662,26,TRUE,24101,46315
1979,13456,1875 WOODLANDS AVE 6 PC NEAR BLK 679,36,,WOODLANDS AVE 6 PC NEAR BLK 679,31,TRUE,24561,46877
1981,13458,2821 WOODLANDS RING RD PC NR BLK 665,36,,WOODLANDS RING RD PC NR BLK 665,31,TRUE,24083,46625
1982,13460,2797 WOODLANDS DR 16 PC NR BLK 573A,35,,WOODLANDS DR 16 PC NR BLK 573A,30,TRUE,24122,45916
1983,13461,1593 WOODLANDS DR 16 PC NR 546,30,,WOODLANDS DR 16 PC NR 546,25,TRUE,23674,45729
