FID,Site_ID,Ident,Ident_Len,Juction_Desc,OBU_Displa,Char_Count,Is_PC,Traffic_Light.Junction_X,Traffic_Light.Junction_Y
0,101,*0355 KEPPEL RD/SHENTON WY/ECP,30,Keppel Rd/Shenton Wy/ECP,KEPPEL RD/SHENTON WY/ECP,24,FALSE,29359,28349
1,102,*#0056 KEPPEL RD/ANSON RD,25,Keppel Rd/Anson Rd,KEPPEL RD/ANSON RD,18,FALSE,29169,28337
2,103,*#0161 KEPPEL RD/CANTONMENT RD,30,Keppel Rd/Cantonment Rd,KEPPEL RD/CANTONMENT RD,23,FALSE,28955,28347
3,104,*#0356 KEPPEL RD/CANTONMENT LK,30,Keppel Rd/Cantonment Lk,KEPPEL RD/CANTONMENT LK,23,FALSE,28735,28340
4,105,0160 CANTONMENT RD/HOE CHIANG RD/YAN KIT RD,43,Cantonment Rd/Hoe Chiang Rd/Yan Kit Rd,CANTONMENT RD/HOE CHIANG RD/YAN KIT RD,38,FALSE,28897,28504
5,106,0843 TANJONG PAGAR/LIM TECK KIM RD/BERNAM,41,Tg Pagar/Lim Teck Kim Rd/Bernam,TANJONG PAGAR/LIM TECK KIM RD/BERNAM,36,FALSE,29101,28444
6,107,0245 TANJONG PAGAR/HOE CHIANG RD/ENGGOR ST,42,Tg Pagar/Hoe Chiang Rd/Enggor St,TANJONG PAGAR/HOE CHIANG RD/ENGGOR ST,37,FALSE,29094,28509
8,110,2803 ANSON RD/GOPENG ST,23,Anson Rd/Gopeng St,ANSON RD/GOPENG ST,18,FALSE,29395,28609
9,111,0842 ANSON RD/BERNAM ST,23,Anson Rd/Bernam St,ANSON RD/BERNAM ST,18,FALSE,29259,28448
10,112,0055 ANSON RD/PALMER RD/ENGGOR ST,33,Anson Rd/Palmer Rd/Enggor St,ANSON RD/PALMER RD/ENGGOR ST,28,FALSE,29325,28527
11,113,0058 ANSON RD/PRINCE EDWARD RD,30,Anson Rd/Prince Edward Rd,ANSON RD/PRINCE EDWARD RD,25,FALSE,29470,28697
12,114,0054 ANSON RD/CECIL ST/ROBINSON RD/MAXWELL RD,45,Anson Rd/Cecil St/Maxwell Rd,ANSON RD/CECIL ST/ROBINSON RD/MAXWELL RD,40,FALSE,29554,28792
13,115,0169 CECIL ST/MCCALLUM ST,25,Cecil St/Mccallum St,CECIL ST/MCCALLUM ST,20,FALSE,29640,29078
14,116,0130 CECIL ST/BOON TAT ST,25,Cecil St/Boon Tat St,CECIL ST/BOON TAT ST,20,FALSE,29754,29254
15,117,*#0168 CECIL ST/CROSS ST,24,Cecil St/Cross St,CECIL ST/CROSS ST,17,FALSE,29802,29345
16,118,*#0167 CECIL ST/CHURCH ST,25,Cecil St/Church St,CECIL ST/CHURCH ST,18,FALSE,29895,29455
17,119,*#0223 CROSS ST/TELOK AYER ST,29,Cross St/Telok Ayer St,CROSS ST/TELOK AYER ST,22,FALSE,29688,29408
18,121,0373 ROBINSON RD/MCCALLUM ST,28,Robinson Rd/Mccallum St,ROBINSON RD/MCCALLUM ST,23,FALSE,29722,29031
19,122,0131 ROBINSON RD/BOON TAT ST,28,Robinson Rd/Boon Tat St,ROBINSON RD/BOON TAT ST,23,FALSE,29832,29209
20,123,*#0221 ROBINSON RD/CROSS ST,27,Robinson Rd/Cross St,ROBINSON RD/CROSS ST,20,FALSE,29892,29294
21,124,*#0170 CECIL ST/ROBINSON RD/COLLYER QY,38,Cecil St/Robinson Rd/Collyer Qy,CECIL ST/ROBINSON RD/COLLYER QY,31,FALSE,29998,29448
23,126,*#0184 CHULIA ST/MARKET ST,26,Chulia St/Market St,CHULIA ST/MARKET ST,19,FALSE,29904,29719
28,131,*#0253 FINLAYSON GREEN/RAFFLES QY/MARINA BLVD,45,Finlayson Green/Raffles Qy/Marina Blvd,FINLAYSON GREEN/RAFFLES QY/MARINA BLVD,38,FALSE,30076,29405
29,132,*#0564 RAFFLES QY/ CROSS ST,27,Raffles Qy/ Cross St,RAFFLES QY/ CROSS ST,20,FALSE,29977,29247
30,133,0132 SHENTON WY/BOON TAT ST/RAFFLES QY,38,Shenton Wy/Boon Tat St/Raffles Qy,SHENTON WY/BOON TAT ST/RAFFLES QY,33,FALSE,29919,29157
32,135,0383 MAXWELL RD/SHENTON WY,26,Maxwell Rd/Shenton Wy,MAXWELL RD/SHENTON WY,21,FALSE,29650,28730
33,136,0427 SHENTON WY/PRINCE EDWARD RD,32,Shenton Wy/Prince Edward Rd,SHENTON WY/PRINCE EDWARD RD,27,FALSE,29572,28608
35,138,0900 SHENTON WY/PALMER RD,25,Shenton Wy/Palmer Rd,SHENTON WY/PALMER RD,20,FALSE,29427,28432
37,140,2900 CENTRAL BLVD/MARINA VIEW,29,Ctrl Blvd/Marina View,CENTRAL BLVD/MARINA VIEW,24,FALSE,30111,29142
38,141,2896 PARK ST/MARINA WAY,23,Park St/Marina Wy,PARK ST/MARINA WAY,18,FALSE,30209,28723
39,142,2371 STRAITS VIEW/CENTRAL BOULEVARD,35,Straits View/Ctrl Blvd,STRAITS VIEW/CENTRAL BOULEVARD,30,FALSE,30212,29075
40,143,2372 CENTRAL BOULEVARD/MARINA STATION RD/MARINA WY,50,Ctrl Blvd/Marina Station Rd/Marina Wy,CENTRAL BOULEVARD/MARINA STATION RD/MARINA WY,45,FALSE,30369,28973
41,144,2895 PARK ST/STRAITS VIEW,25,Park St/Straits View,PARK ST/STRAITS VIEW,20,FALSE,30212,29075
42,145,2894 PARK ST/MARINA VIEW,24,Park St/Marina View,PARK ST/MARINA VIEW,19,FALSE,29966,28886
43,146,2893 PARK ST/SHENTON LANE,25,Park St/Shenton Ln,PARK ST/SHENTON LANE,20,FALSE,29871,28948
44,147,2621 STRAITS VIEW/COMMERCE ST,29,Straits View/Commerce St,STRAITS VIEW/COMMERCE ST,24,FALSE,30162,29003
45,148,2523 MARINA VIEW / COMMERCE ST,30,Marina View/Commerce St,MARINA VIEW / COMMERCE ST,25,FALSE,30080,29053
46,149,2252 STRAITS BLVD/MARINA VIEW,29,Straits Blvd/Marina View,STRAITS BLVD/MARINA VIEW,24,FALSE,29804,28622
47,150,2373 MARINA BLVD/MARINA VIEW,28,Marina Blvd/Marina View,MARINA BLVD/MARINA VIEW,23,FALSE,30240,29300
48,151,2133 MARINA BOULEVARD/STRAITS VIEW,34,Marina Blvd/Straits View,MARINA BOULEVARD/STRAITS VIEW,29,FALSE,30155,29354
49,152,2134 MARINA BOULEVARD/MARINA WAY,32,Marina Blvd/Marina Wy,MARINA BOULEVARD/MARINA WAY,27,FALSE,30480,29146
50,153,2135 BAYFRONT AVE/BAYFRONT LINK,31,Bayfront Ave/Bayfront Lk,BAYFRONT AVE/BAYFRONT LINK,26,FALSE,30802,29270
51,154,2136 BAYFRONT AVE/SHEARES LINK,30,Bayfront Ave/Sheares Lk,BAYFRONT AVE/SHEARES LINK,25,FALSE,30904,29428
52,155,2051 BAYFRONT AVE/MARINA BOULEVARD,34,Bayfront Ave/Marina Blvd,BAYFRONT AVE/MARINA BOULEVARD,29,FALSE,30651,29037
53,156,2241 BAYFRONT AVE/MBSIR CP ACCESS,33,Bayfront Ave/Mbsir Cp Access,BAYFRONT AVE/MBSIR CP ACCESS,28,FALSE,31009,29594
54,157,2329 SHEARES AVE/SHEARES LK,27,Sheares Ave/Sheares Lk,SHEARES AVE/SHEARES LK,22,FALSE,31040,29342
55,158,*#2330 MARINA BLVD/SHEARES AVE,30,Marina Blvd/Sheares Ave,MARINA BLVD/SHEARES AVE,23,FALSE,30797,28942
56,159,*#2331 MARINA BLVD/MARINA GARDENS DR,36,Marina Blvd/Marina Gardens Dr,MARINA BLVD/MARINA GARDENS DR,29,FALSE,31187,28690
57,160,2784 MARINA BLVD/MARINA MALL,28,Marina Blvd/Marina Mall,MARINA BLVD/MARINA MALL,23,FALSE,30653,29039
58,162,2332 CENTRAL BLVD/MARINA GARDENS DR,35,Ctrl Blvd/Marina Gardens Dr,CENTRAL BLVD/MARINA GARDENS DR,30,FALSE,31077,28520
59,163,2333 CENTRAL BLVD/SHEARES AVE,29,Ctrl Blvd/Sheares Ave,CENTRAL BLVD/SHEARES AVE,24,FALSE,30679,28772
60,164,2334 CENTRAL BLVD/BAYFRONT AVE,30,Ctrl Blvd/Bayfront Ave,CENTRAL BLVD/BAYFRONT AVE,25,FALSE,30539,28868
61,171,2335 MARINA COASTAL DR/MARINA LK/MCE,36,Marina Coastal Dr/Marina Lk/MCE,MARINA COASTAL DR/MARINA LK/MCE,31,FALSE,31501,28491
62,172,2336 MCE/CENTRAL BLVD,21,MCE/Ctrl Blvd,MCE/CENTRAL BLVD,16,FALSE,31319,28363
64,181,2899 SHEARES AVE/PARK ST,24,Sheares Ave/Park St,SHEARES AVE/PARK ST,19,FALSE,30533,28550
65,182,3014 PARK ST/BAYFRONT AVE,25,Park St/Bayfront Ave,PARK ST/BAYFRONT AVE,20,FALSE,30379,28613
66,199,3003 TANJONG PAGAR RD/TRAS LINK,31,Tg Pagar Rd/Tras Lk,TANJONG PAGAR RD/TRAS LINK,26,FALSE,29122,28753
67,201,0204 NTH BRIDGE RD/COLEMAN ST,29,Nth Bridge Rd/Coleman St,NTH BRIDGE RD/COLEMAN ST,24,FALSE,29962,30465
68,202,0283 NTH BRIDGE RD/HIGH ST,26,Nth Bridge Rd/High St,NTH BRIDGE RD/HIGH ST,21,FALSE,29856,30288
69,203,*#0403 SOUTH BRIDGE RD/NTH CANAL RD,35,Sth Bridge Rd/Nth Canal Rd,SOUTH BRIDGE RD/NTH CANAL RD,28,FALSE,29612,29875
70,204,*#0426 SOUTH BRIDGE RD/PICKERING/UPP PICKERING,46,Sth Bridge Rd/Pickering/Upp Pickering,SOUTH BRIDGE RD/PICKERING/UPP PICKERING,39,FALSE,29543,29762
71,205,*#0222 SOUTH BRIDGE RD/CROSS/UPP CROSS ST,41,Sth Bridge Rd/Cross/Upp Cross St,SOUTH BRIDGE RD/CROSS/UPP CROSS ST,34,FALSE,29421,29563
73,207,0382 SOUTH BRIDGE RD/MAXWELL RD/NEIL RD/TG,42,Sth Bridge Rd/Maxwell Rd/Neil Rd/Tg,SOUTH BRIDGE RD/MAXWELL RD/NEIL RD/TG,37,FALSE,29199,29209
74,208,0162 CANTONMENT RD/NEIL RD,26,Cantonment Rd/Neil Rd,CANTONMENT RD/NEIL RD,21,FALSE,28794,28942
76,210,0354 KAMPONG BAHRU/NEIL RD/HOSPITAL DR,38,Kampong Bahru/Neil Rd/Hospital Dr,KAMPONG BAHRU/NEIL RD/HOSPITAL DR,33,FALSE,28412,28903
77,211,0163 CANTONMENT RD/NEW BRIDGE RD/OUTRAM RD,42,Cantonment Rd/New Bridge Rd/Outram Rd,CANTONMENT RD/NEW BRIDGE RD/OUTRAM RD,37,FALSE,28703,29140
78,212,0247 EU TONG SEN ST/PEARL'S HILL TCE/KRETA AYER,47,Eu Tong Sen St/Kreta Ayer Rd,EU TONG SEN ST/PEARL'S HILL TCE/KRETA AYER,42,FALSE,28879,29365
79,213,*#0248 EU TONG SEN ST/NEW BRIDGE RD/UPP CROSS ST,48,Eu Tong Sen St/Upp Cross St,EU TONG SEN ST/NEW BRIDGE RD/UPP CROSS ST,41,FALSE,29176,29711
80,214,*#0156 EU TONG SEN ST/NEW BRIDGE RD/HAVELOCK,44,Eu Tong Sen St/New Bridge Rd/Havelock,EU TONG SEN ST/NEW BRIDGE RD/HAVELOCK,37,FALSE,29324,29888
81,215,*#0384 EU TONG SEN ST/MERCHANT RD/NTH CANAL RD,46,Eu Tong Sen St/Merchant Rd/N Canal Rd,EU TONG SEN ST/MERCHANT RD/NTH CANAL RD,39,FALSE,29406,29982
83,217,0285 EU TONG SEN ST/HILL ST/RIVER VALLEY RD,43,Eu Tong Sen St/Hill St/River Valley Rd,EU TONG SEN ST/HILL ST/RIVER VALLEY RD,38,FALSE,29669,30278
84,218,0931 HILL ST/HIGH ST,20,Hill St/High St,HILL ST/HIGH ST,15,FALSE,29735,30384
85,219,0203 HILL ST/COLEMAN ST/CANNING RISE,36,Hill St/Coleman St/Canning Rise,HILL ST/COLEMAN ST/CANNING RISE,31,FALSE,29809,30544
86,220,0159 CANNING RISE/ARMENIAN ST/COLEMAN ST,40,Canning Rise/Armenian St/Coleman St,CANNING RISE/ARMENIAN ST/COLEMAN ST,35,FALSE,29705,30639
87,221,0157 HAVELOCK RD/NEW MARKET RD,30,Havelock Rd/New Market Rd,HAVELOCK RD/NEW MARKET RD,25,FALSE,29246,29933
88,222,0424 PEARL'S HILL TERRACE CONTROL,33,Pearl's Hill Terrace Control,PEARL'S HILL TERRACE CONTROL,28,FALSE,28833,29436
94,230,2500 EU TONG SEN ST/NEW BRIDGE RD/TEO HONG RD,45,Eu Tong Sen St/Teo Hong Rd,EU TONG SEN ST/NEW BRIDGE RD/TEO HONG RD,40,FALSE,28798,29232
98,234,1626 NORTH BRIDGE RD NR PARLIAMENT HOUSE,40,Nth Bridge Rd Nr Parliament House,NORTH BRIDGE RD NR PARLIAMENT HOUSE,35,FALSE,29827,30242
100,300,3043 OUTRAM RD/TIONG BAHRU RD/SENG POH RD,41,Outram Rd/Tiong Bahru Rd/Seng Poh Rd,OUTRAM RD/TIONG BAHRU RD/SENG POH RD,36,FALSE,28026,29824
101,301,0441 TIONG BAHRU RD/ZION RD/SENG POH RD,39,Tiong Bahru Rd/Zion Rd/Seng Poh Rd,TIONG BAHRU RD/ZION RD/SENG POH RD,34,FALSE,28039,29765
102,302,0257 ZION RD/GANGES AVE,23,Zion Rd/Ganges Ave,ZION RD/GANGES AVE,18,FALSE,28000,30260
104,304,0294 ZION RD/RIVER VALLEY/HOOT KIAM RD,38,Zion Rd/River Valley/Hoot Kiam Rd,ZION RD/RIVER VALLEY/HOOT KIAM RD,33,FALSE,27662,30887
105,305,*#0268 PATERSON HILL/HOOT KIAM RD/IRWELL BANK RD,48,Paterson Hill/Hoot Kiam Rd,PATERSON HILL/HOOT KIAM RD/IRWELL BANK RD,41,FALSE,27632,31288
107,307,1549 RIVER VALLEY RD/NATHAN RD,30,River Valley Rd/Nathan Rd,RIVER VALLEY RD/NATHAN RD,25,FALSE,27347,30711
108,308,2129 RIVER VALLEY RD/JERVOIS RD/DELTA RD,40,River Valley Rd/Jervois Rd/Delta Rd,RIVER VALLEY RD/JERVOIS RD/DELTA RD,35,FALSE,27185,30577
110,311,*#0302 KIM SENG RD/RIVER VALLEY RD/IRWELL BA,44,Kim Seng Rd/River Valley Rd/Irwell Ba,KIM SENG RD/RIVER VALLEY RD/IRWELL BA,37,FALSE,27787,30932
111,312,0275 KIM SENG RD/HAVELOCK RD/OUTRAM RD,38,Kim Seng Rd/Havelock Rd/Outram Rd,KIM SENG RD/HAVELOCK RD/OUTRAM RD,33,FALSE,28184,30201
113,314,*#1018 CHIN SWEE RD/OUTRAM RD,29,Chin Swee Rd/Outram Rd,CHIN SWEE RD/OUTRAM RD,22,FALSE,28309,29504
115,316,0180 HAVELOCK RD/CHIN SWEE RD/CLEMENCEAU AVE,44,Havelock Rd/Clemenceau Ave,HAVELOCK RD/CHIN SWEE RD/CLEMENCEAU AVE,39,FALSE,28889,30114
116,317,1421 HAVELOCK RD/SAIBOO ST,26,Havelock Rd/Saiboo St,HAVELOCK RD/SAIBOO ST,21,FALSE,28502,30138
119,321,2319 RIVER VALLEY RD/CLARKE QUAY,32,River Valley Rd/Clarke Quay,RIVER VALLEY RD/CLARKE QUAY,27,FALSE,29249,30534
120,322,*#0194 CLEMENCEAU AVENUE / RIVER VALLEY RD,42,Clemenceau Ave/River Valley Rd,CLEMENCEAU AVENUE / RIVER VALLEY RD,35,FALSE,29158,30604
121,323,*#0679 RIVER VALLEY RD/KIM YAM RD,33,River Valley Rd/Kim Yam Rd,RIVER VALLEY RD/KIM YAM RD,26,FALSE,28612,30906
122,324,*#0359 RIVER VALLEY RD/KILLINEY RD,34,River Valley Rd/Killiney Rd,RIVER VALLEY RD/KILLINEY RD,27,FALSE,28454,30886
124,326,1027 CLEMENCEAU AVE/MERCHANT RD,31,Clemenceau Ave/Merchant Rd,CLEMENCEAU AVE/MERCHANT RD,26,FALSE,28981,30275
127,330,3004 RIVER VALLEY CLOSE/RIVER VALLEY GREEN,42,River Valley Close/River Valley Green,RIVER VALLEY CLOSE/RIVER VALLEY GREEN,37,FALSE,28403,30627
129,332,3006 RIVER VALLEY GREEN / KIM SENG RD,37,River Valley Green/Kim Seng Rd,RIVER VALLEY GREEN / KIM SENG RD,32,FALSE,28036,30664
130,400,*#0857 ROCHALIE RD/TANGLIN ROAD,31,Rochalie Rd/Tanglin Rd,ROCHALIE RD/TANGLIN ROAD,24,FALSE,26469,31605
131,401,*#0270 TANGLIN RD/NAPIER RD/GRANGE RD,37,Tanglin Rd/Napier Rd/Grange Rd,TANGLIN RD/NAPIER RD/GRANGE RD,30,FALSE,26783,31893
132,402,0467 TANGLIN RD/TOMLINSON RD,28,Tanglin Rd/Tomlinson Rd,TANGLIN RD/TOMLINSON RD,23,FALSE,27099,31995
133,403,0412 TANGLIN RD/ORANGE GROVE RD/ORCHARD RD,42,Tanglin Rd/Orange Grove Rd/Orchard Rd,TANGLIN RD/ORANGE GROVE RD/ORCHARD RD,37,FALSE,27409,32158
135,405,0413 ORCHARD RD/SCOTTS RD,25,Orchard Rd/Scotts Rd,ORCHARD RD/SCOTTS RD,20,FALSE,27826,31938
137,407,*#0409 ORCHARD RD/BIDEFORD RD,29,Orchard Rd/Bideford Rd,ORCHARD RD/BIDEFORD RD,22,FALSE,28301,31674
138,408,*#0155 ORCHARD RD/GRANGE RD/CAIRNHILL RD,40,Orchard Rd/Grange Rd/Cairnhill Rd,ORCHARD RD/GRANGE RD/CAIRNHILL RD,33,FALSE,28462,31590
140,410,*#0358 ORCHARD RD/KOEK RD/KILLINEY RD,37,Orchard Rd/Koek Rd/Killiney Rd,ORCHARD RD/KOEK RD/KILLINEY RD,30,FALSE,28822,31454
141,411,*#0191 ORCHARD RD/ISTANA,24,Orchard Rd/Istana,ORCHARD RD/ISTANA,17,FALSE,29150,31351
142,413,1138 GRANGE RD/SOMERSET RD,26,Grange Rd/Somerset Rd,GRANGE RD/SOMERSET RD,21,FALSE,28358,31472
143,415,1170 ORCHARD BOULEVARD/ORCHARD LK/GRANGE RD,43,Orchard Blvd/Orchard Lk/Grange Rd,ORCHARD BOULEVARD/ORCHARD LK/GRANGE RD,38,FALSE,28167,31422
145,419,*#1053 PENANG RD/PENANG LANE,28,Penang Rd/Penang Ln,PENANG RD/PENANG LANE,21,FALSE,29242,31203
147,421,*#0193 PENANG RD/CLEMENCEAU AVE,31,Penang Rd/Clemenceau Ave,PENANG RD/CLEMENCEAU AVE,24,FALSE,29154,31243
148,422,*#0415 PENANG RD/OXLEY RD,25,Penang Rd/Oxley Rd,PENANG RD/OXLEY RD,18,FALSE,28925,31347
149,423,0360 SOMERSET RD/KILLINEY RD,28,Somerset Rd/Killiney Rd,SOMERSET RD/KILLINEY RD,23,FALSE,28772,31379
7,109,1874 KEPPEL ROAD PC RAILWAY STATION,35,,KEPPEL ROAD PC RAILWAY STATION,30,TRUE,28544,28322
22,125,0186 CHURCH ST PC NR PHILIP ST,30,,CHURCH ST PC NR PHILIP ST,25,TRUE,29814,29586
24,127,1818 MARKET ST PC NR MALACCA ST,31,,MARKET ST PC NR MALACCA ST,26,TRUE,29894,29578
25,128,2149 TELEGRAPH ST PC,20,,TELEGRAPH ST PC,15,TRUE,29950,29367
26,129,2605 FULLERTON SQUARE PC,24,,FULLERTON SQUARE PC,19,TRUE,30157,29753
27,130,*#1463 FULLERTON RD PC NR ESPLANDE DR,37,,FULLERTON RD PC NR ESPLANDE DR,30,TRUE,30275,29863
31,134,0372 MCCALLUM ST PC,19,,MCCALLUM ST PC,14,TRUE,29807,28981
34,137,0449 SHENTON WY PC NR PARSI RD,30,,SHENTON WY PC NR PARSI RD,25,TRUE,29488,28505
36,139,0963 MAXWELL RD PC I/F MND BUILDING,35,,MAXWELL RD PC I/F MND BUILDING,30,TRUE,29370,29002
63,173,2422 MARINA COASTAL DR PC,25,,MARINA COASTAL DR PC,20,TRUE,31394,28272
72,206,0459 SOUTH BRIDGE RD PC NR SMITH ST,35,,SOUTH BRIDGE RD PC NR SMITH ST,30,TRUE,29302,29363
75,209,2224 CANTONMENT RD PC NR PINNACLE DUXTON,40,,CANTONMENT RD PC NR PINNACLE DUXTON,35,TRUE,28839,28704
82,216,0396 EU TONG SEN ST PC NR CARPENTER ST,38,,EU TONG SEN ST PC NR CARPENTER ST,33,TRUE,29539,30109
89,223,0681 FORT CANNING RD PC NR CHURCH,33,,FORT CANNING RD PC NR CHURCH,28,TRUE,29676,31073
90,224,1778 OXLEY RISE PC NR OXLEY WALK,32,,OXLEY RISE PC NR OXLEY WALK,27,TRUE,29062,31098
91,225,1987 OUTRAM RD PC NR 2ND HOSPITAL AVE,37,,OUTRAM RD PC NR 2ND HOSPITAL AVE,32,TRUE,28639,29268
92,226,2013 STAMFORD RD PC SMU,23,,STAMFORD RD PC SMU,18,TRUE,29807,30968
93,227,2034 FORT CANNING RD PC I/F PARK MALL,37,,FORT CANNING RD PC I/F PARK MALL,32,TRUE,29358,31076
95,231,0244 FULLERTON RD PC NR CONNAUGHT DR,36,,FULLERTON RD PC NR CONNAUGHT DR,31,TRUE,30159,29990
96,232,0284 PARLIMENT PL PC NR ST ANDREW'S RD,38,,PARLIMENT PL PC NR ST ANDREW'S RD,33,TRUE,30018,30155
97,233,0460 ST ANDREW'S RD PC CITY HALL,32,,ST ANDREW'S RD PC CITY HALL,27,TRUE,30128,30374
99,235,2664 SOUTH BRIDGE RD PC NEAR UPP CIRCULAR RD,44,,SOUTH BRIDGE RD PC NEAR UPP CIRCULAR RD,39,TRUE,29699,30031
103,303,0515 ZION RD PC I/F ZION RIVERSIDE FOOD CENTRE,46,,ZION RD PC I/F ZION RIVERSIDE FOOD CENTRE,41,TRUE,27899,30428
106,306,1498 ZION RD PC NR GREAT WORLD CITY,35,,ZION RD PC NR GREAT WORLD CITY,30,TRUE,27744,30709
109,309,3079 DELTA RD PC NR LP3 OPP BLK 4,33,,DELTA RD PC NR LP3 OPP BLK 4,28,TRUE,27178,30507
112,313,0414 OUTRAM RD PC I/F YMCA,26,,OUTRAM RD PC I/F YMCA,21,TRUE,28233,29589
114,315,0326 CHIN SWEE RD PC NR JLN KUKOH,33,,CHIN SWEE RD PC NR JLN KUKOH,28,TRUE,28754,29966
117,318,1526 KIM SENG RD PC NR 91,25,,KIM SENG RD PC NR 91,20,TRUE,28103,30357
118,319,2737 KIM SENG RD PC NR GWC,26,,KIM SENG RD PC NR GWC,21,TRUE,27885,30757
123,325,0602 RIVER VALLEY RD PC NR JLN KUALA,36,,RIVER VALLEY RD PC NR JLN KUALA,31,TRUE,28243,30922
125,327,1846 RIVER VALLEY RD PC INSTITUTION HILL,40,,RIVER VALLEY RD PC INSTITUTION HILL,35,TRUE,28755,30920
126,329,2646 RIVER VALLEY RD PC NR MOHD SULTAN RD,41,,RIVER VALLEY RD PC NR MOHD SULTAN RD,36,TRUE,29000,30707
128,331,3005 RIVER VALLEY GREEN PC NR RIVER VALLEY PRI SCH,50,,RIVER VALLEY GREEN PC NR RIVER VALLEY PRI SCH,45,TRUE,28275,30632
134,404,0535 ORCHARD RD PC NR ANGULLIA PK,33,,ORCHARD RD PC NR ANGULLIA PK,28,TRUE,27689,32008
136,406,1995 ORCHARD RD PC NR CLAYMORE RD,33,,ORCHARD RD PC NR CLAYMORE RD,28,TRUE,27473,32125
139,409,0410 ORCHARD RD PC NR 313 SOMERSET,34,,ORCHARD RD PC NR 313 SOMERSET,29,TRUE,28746,31478
144,416,1999 ORCHARD TURN PC NR NGEE ANN CITY,37,,ORCHARD TURN PC NR NGEE ANN CITY,32,TRUE,28120,31612
146,420,0331 PENANG RD PC I/F PARKMALL,30,,PENANG RD PC I/F PARKMALL,25,TRUE,29332,31176
150,424,0458 SOMERSET RD PC NR 313 SOMERSET,35,,SOMERSET RD PC NR 313 SOMERSET,30,TRUE,28472,31443
151,425,0224 DEVONSHIRE RD/GRANGE RD,28,Devonshire Rd/Grange Rd,DEVONSHIRE RD/GRANGE RD,23,FALSE,28248,31389
152,426,0406 ORCHARD BLVD/ORCHARD TURN SERVICE RD,41,Orchard Blvd/Orchard Turn Service Rd,ORCHARD BLVD/ORCHARD TURN SERVICE RD,36,FALSE,27950,31620
153,427,*#0407 ORCHARD BLVD/PATERSON RD,31,Orchard Blvd/Paterson Rd,ORCHARD BLVD/PATERSON RD,24,FALSE,27713,31806
154,428,0408 ORCHARD BLVD/TOMLINSON RD,30,Orchard Blvd/Tomlinson Rd,ORCHARD BLVD/TOMLINSON RD,25,FALSE,27209,31755
155,429,*#0269 ORCHARD BLVD/GRANGE RD,29,Orchard Blvd/Grange Rd,ORCHARD BLVD/GRANGE RD,22,FALSE,26897,31642
156,430,0865 CUSCADEN RD/TOMLINSON RD,29,Cuscaden Rd/Tomlinson Rd,CUSCADEN RD/TOMLINSON RD,24,FALSE,27147,31892
157,431,*#0243 OXLEY RD/OXLEY RISE/EBER RD,34,Oxley Rd/Oxley Rise/Eber Rd,OXLEY RD/OXLEY RISE/EBER RD,27,FALSE,28892,31270
158,432,0242 EBER RD/EXETER RD/KILLINEY RD,34,Eber Rd/Exeter Rd/Killiney Rd,EBER RD/EXETER RD/KILLINEY RD,29,FALSE,28701,31290
160,435,*#1019 ORCHARD RD/BUYONG RD,27,Orchard Rd/Buyong Rd,ORCHARD RD/BUYONG RD,20,FALSE,29078,31374
161,441,1140 BUYONG RD/CAVENAGH RD/KRAMAT RD,36,Buyong Rd/Cavenagh Rd/Kramat Rd,BUYONG RD/CAVENAGH RD/KRAMAT RD,31,FALSE,29102,31478
162,442,1139 CAVENAGH RD/KRAMAT RD,26,Cavenagh Rd/Kramat Rd,CAVENAGH RD/KRAMAT RD,21,FALSE,28912,31568
163,443,0192 CLEMENCEAU AVE NTH/ANTHONY RD,34,Clemenceau Ave Nth/Anthony Rd,CLEMENCEAU AVE NTH/ANTHONY RD,29,FALSE,28673,32584
164,444,0165 CAVENAGH RD/ISTANA BACK GATE,33,Cavenagh Rd/Istana Back Gate,CAVENAGH RD/ISTANA BACK GATE,28,FALSE,28964,32253
165,445,0436 STEVENS RD/SCOTTS RD,25,Stevens Rd/Scotts Rd,STEVENS RD/SCOTTS RD,20,FALSE,28027,32361
166,446,0841 SCOTTS RD/CAIRNHILL RD,27,Scotts Rd/Cairnhill Rd,SCOTTS RD/CAIRNHILL RD,22,FALSE,28249,32555
167,447,0877 CAIRNHILL RD/ANTHONY RD,28,Cairnhill Rd/Anthony Rd,CAIRNHILL RD/ANTHONY RD,23,FALSE,28331,32431
168,448,2181 CLEMENCEAU AVE NTH/WINSTEDT RD,35,Clemenceau Ave Nth/Winstedt Rd,CLEMENCEAU AVE NTH/WINSTEDT RD,30,FALSE,28710,32419
170,451,1086 CAIRNHILL CIRCLE/CAIRNHILL CIRCLE,38,Cairnhill Cir/Cairnhill Cir,CAIRNHILL CIRCLE/CAIRNHILL CIRCLE,33,FALSE,28596,32048
171,452,*#1087 CAIRNHILL CIRCLE/CAIRNHILL RD,36,Cairnhill Cir/Cairnhill Rd,CAIRNHILL CIRCLE/CAIRNHILL RD,29,FALSE,28493,32017
172,453,*#1269 BIDEFORD RD/MT ELIZABETH LK,34,Bideford Rd/Mt Elizabeth Lk,BIDEFORD RD/MT ELIZABETH LK,27,FALSE,28414,31952
173,462,1821 ORCHARD RD/OLDHAM LANE,27,Orchard Rd/Oldham Ln,ORCHARD RD/OLDHAM LANE,22,FALSE,29388,31272
177,502,0862 STAMFORD RD/NICOLL HWY/RAFFLES AVE,39,Stamford Rd/Nicoll Hwy/Raffles Ave,STAMFORD RD/NICOLL HWY/RAFFLES AVE,34,FALSE,30405,30422
178,503,0079 STAMFORD RD/BEACH RD/ST ANDREW'S RD,40,Stamford Rd/Beach Rd/St Andrew's Rd,STAMFORD RD/BEACH RD/ST ANDREW'S RD,35,FALSE,30282,30544
179,504,0399 STAMFORD RD/NTH BRIDGE RD,30,Stamford Rd/Nth Bridge Rd,STAMFORD RD/NTH BRIDGE RD,25,FALSE,30083,30662
180,505,*#0286 STAMFORD RD/HILL ST/VICTORIA ST,38,Stamford Rd/Hill St/Victoria St,STAMFORD RD/HILL ST/VICTORIA ST,31,FALSE,29923,30765
181,506,0062 STAMFORD RD/FORT CANNING LINK/ARMENIAN ST,46,Stamford Rd/Fort Canning Lk,STAMFORD RD/FORT CANNING LINK/ARMENIAN ST,41,FALSE,29827,30811
182,507,0111 STAMFORD RD/BENCOOLEN ST/FORT CANNING,42,Stamford Rd/Bencoolen St/Fort Canning,STAMFORD RD/BENCOOLEN ST/FORT CANNING,37,FALSE,29737,31069
183,508,0274 ORCHARD RD/HANDY RD/PENANG RD,34,Orchard Rd/Handy Rd/Penang Rd,ORCHARD RD/HANDY RD/PENANG RD,29,FALSE,29557,31229
184,509,2292 BRAS BASAH RD/WATERLOO ST,30,Bras Basah Rd/Waterloo St,BRAS BASAH RD/WATERLOO ST,25,FALSE,29894,31075
186,511,0226 BRAS BASAH/PRINSEP ST/ORCHARD RD,37,Bras Basah/Prinsep St/Orchard Rd,BRAS BASAH/PRINSEP ST/ORCHARD RD,32,FALSE,29712,31218
187,512,0106 BRAS BASAH RD/BENCOOLEN ST,31,Bras Basah Rd/Bencoolen St,BRAS BASAH RD/BENCOOLEN ST,26,FALSE,29805,31146
188,513,0140 BRAS BASAH RD/QUEEN ST,27,Bras Basah Rd/Queen St,BRAS BASAH RD/QUEEN ST,22,FALSE,29894,31075
189,514,*#0139 BRAS BASAH RD/VICTORIA ST,32,Bras Basah Rd/Victoria St,BRAS BASAH RD/VICTORIA ST,25,FALSE,30072,30927
190,515,*#0138 BRAS BASAH RD/NTH BRIDGE RD,34,Bras Basah Rd/Nth Bridge Rd,BRAS BASAH RD/NTH BRIDGE RD,27,FALSE,30204,30834
191,516,0074 BRAS BASAH RD/BEACH RD,27,Bras Basah Rd/Beach Rd,BRAS BASAH RD/BEACH RD,22,FALSE,30378,30702
192,517,*#0641 BRAS BASAH RD/NICOLL HWY/RAFFLES BLVD,44,Bras Basah Rd/Nicoll Hwy/Raffles Blvd,BRAS BASAH RD/NICOLL HWY/RAFFLES BLVD,37,FALSE,30512,30609
193,518,0643 TEMASEK AVE/RAFFLES BLVD,29,Temasek Ave/Raffles Blvd,TEMASEK AVE/RAFFLES BLVD,24,FALSE,31068,30413
194,519,0642 RAFFLES AVE/RAFFLES BLVD/REPUBLIC BLVD,43,Raffles Ave/Raffles Blvd/Republic Blvd,RAFFLES AVE/RAFFLES BLVD/REPUBLIC BLVD,38,FALSE,31304,30359
195,520,0644 RAFFLES AVE/TEMASEK AVE,28,Raffles Ave/Temasek Ave,RAFFLES AVE/TEMASEK AVE,23,FALSE,31070,30215
196,521,0076 BEACH RD/MIDDLE RD,23,Beach Rd/Middle Rd,BEACH RD/MIDDLE RD,18,FALSE,30569,30999
197,522,0385 NTH BRIDGE RD/MIDDLE RD,28,Nth Bridge Rd/Middle Rd,NTH BRIDGE RD/MIDDLE RD,23,FALSE,30417,31115
198,523,0388 VICTORIA ST/MIDDLE RD,26,Victoria St/Middle Rd,VICTORIA ST/MIDDLE RD,21,FALSE,30306,31206
199,524,0651 MIDDLE RD/QUEEN ST,23,Middle Rd/Queen St,MIDDLE RD/QUEEN ST,18,FALSE,30211,31281
200,525,0389 MIDDLE RD/WATERLOO ST,26,Middle Rd/Waterloo St,MIDDLE RD/WATERLOO ST,21,FALSE,30126,31353
201,526,0110 BENCOOLEN ST/MIDDLE RD,27,Bencoolen St/Middle Rd,BENCOOLEN ST/MIDDLE RD,22,FALSE,30037,31420
202,527,0386 MIDDLE RD/PRINSEP ST,25,Middle Rd/Prinsep St,MIDDLE RD/PRINSEP ST,20,FALSE,29947,31493
203,528,0387 SELEGIE RD/MIDDLE RD/SHORT ST/SOPHIA RD,44,Selegie Rd/Middle Rd/Sophia Rd,SELEGIE RD/MIDDLE RD/SHORT ST/SOPHIA RD,39,FALSE,29828,31555
209,541,1430 REPUBLIC BOULEVARD/REPUBLIC AVE,36,Republic Blvd/Republic Ave,REPUBLIC BOULEVARD/REPUBLIC AVE,31,FALSE,31277,31047
210,543,1618 Republic Ave Near Nicoll Highway MRT,41,Republic Ave Near Nicoll Hwy Mrt,Republic Ave Near Nicoll Highway MRT,36,FALSE,31425,31365
211,551,1817 NICOLL HWY/MIDDLE RD,25,Nicoll Hwy/Middle Rd,NICOLL HWY/MIDDLE RD,20,FALSE,30677,30878
213,601,*#0078 ROCHOR RD/BEACH RD,25,Rochor Rd/Beach Rd,ROCHOR RD/BEACH RD,18,FALSE,30744,31189
214,602,*#0398 ROCHOR RD/NTH BRIDGE RD,30,Rochor Rd/Nth Bridge Rd,ROCHOR RD/NTH BRIDGE RD,23,FALSE,30596,31355
215,603,*#0435 ROCHOR RD/VICTORIA ST,28,Rochor Rd/Victoria St,ROCHOR RD/VICTORIA ST,21,FALSE,30508,31444
216,604,0428 ROCHOR RD/QUEEN ST,23,Rochor Rd/Queen St,ROCHOR RD/QUEEN ST,18,FALSE,30420,31529
217,606,*#0109 BENCOOLEN ST/JLN BESAR/ROCHOR CANAL RD,45,Bencoolen St/Jln Besar/Rochor Canal Rd,BENCOOLEN ST/JLN BESAR/ROCHOR CANAL RD,38,FALSE,30280,31709
220,609,*#0153 BUKIT TIMAH RD/SELEGIE RD/SERANGOON RD,45,Bt Timah Rd/Selegie Rd/Serangoon Rd,BUKIT TIMAH RD/SELEGIE RD/SERANGOON RD,38,FALSE,29956,31932
222,611,*#0150 BUKIT TIMAH RD/KG JAVA RD,32,Bt Timah Rd/Kg Java Rd,BUKIT TIMAH RD/KG JAVA RD,25,FALSE,29532,32302
223,612,*#0145 BUKIT TIMAH RD/CAVENAGH RD,33,Bt Timah Rd/Cavenagh Rd,BUKIT TIMAH RD/CAVENAGH RD,26,FALSE,29225,32535
224,613,1435 BUKIT TIMAH RD/RACE COURSE RD,34,Bt Timah Rd/Race Course Rd,BUKIT TIMAH RD/RACE COURSE RD,29,FALSE,29794,32070
227,621,0404 OPHIR RD/QUEEN ST,22,Ophir Rd/Queen St,OPHIR RD/QUEEN ST,17,FALSE,30533,31662
228,622,*#0405 OPHIR RD/VICTORIA ST,27,Ophir Rd/Victoria St,OPHIR RD/VICTORIA ST,20,FALSE,30633,31588
229,623,*#0397 OPHIR RD/NTH BRIDGE RD,29,Ophir Rd/Nth Bridge Rd,OPHIR RD/NTH BRIDGE RD,22,FALSE,30733,31514
230,624,*#0077 OPHIR RD/BEACH RD,24,Ophir Rd/Beach Rd,OPHIR RD/BEACH RD,17,FALSE,30895,31337
231,625,*#1862 OPHIR RD/REPUBLIC AVE,28,Ophir Rd/Republic Ave,OPHIR RD/REPUBLIC AVE,21,FALSE,31098,30872
233,701,0060 ROCHOR CANAL RD/ARAB ST/WELD RD,36,Rochor Canal Rd/Arab St/Weld Rd,ROCHOR CANAL RD/ARAB ST/WELD RD,31,FALSE,30568,31826
234,702,0333 ROCHOR CANAL RD/SYED ALWI RD,33,Rochor Canal Rd/Syed Alwi Rd,ROCHOR CANAL RD/SYED ALWI RD,28,FALSE,30927,32021
236,704,1121 HORNE RD/KING GEORGE'S AVE,31,Horne Rd/King George's Ave,HORNE RD/KING GEORGE'S AVE,26,FALSE,31129,32448
238,711,*#0061 VICTORIA ST/ARAB ST,26,Victoria St/Arab St,VICTORIA ST/ARAB ST,19,FALSE,30714,31680
239,712,0334 JLN SULTAN/VICTORIA ST,27,Jln Sultan/Victoria St,JLN SULTAN/VICTORIA ST,22,FALSE,30991,31928
241,714,*#0220 LAVENDER ST/KALLANG RD/CRAWFORD ST,41,Lavender St/Kallang Rd/Crawford St,LAVENDER ST/KALLANG RD/CRAWFORD ST,34,FALSE,31414,32327
242,715,0351 KALLANG RD/KG BUGIS,24,Kallang Rd/Kg Bugis,KALLANG RD/KG BUGIS,19,FALSE,31605,32386
244,719,1617 CRAWFORD ST/BEACH RD,25,Crawford St/Beach Rd,CRAWFORD ST/BEACH RD,20,FALSE,31655,31851
245,720,1181 CRAWFORD ST/NTH BRIDGE RD,30,Crawford St/Nth Bridge Rd,CRAWFORD ST/NTH BRIDGE RD,25,FALSE,31509,32055
